full_text,Emotional_disclosure,Information_disclosure,score,emo_disc.1,emo_disc.2,emo_disc.3,emo_disc.4,info_disc.1,info_disc.2,info_disc.3,info_disc.4,Throughput.1,Throughput.2,Throughput.3,Throughput.4,WorkTime.1,WorkTime.2,WorkTime.3,WorkTime.4,popularity
People want to carry on their family line by spreading their genetics.,0,0,30,True,False,True,False,True,False,True,False,858,29,285,153,7,28,20,15,1.0
People were friendly and helpful.,0,0,40,False,True,True,False,False,True,True,False,858,13,11,60,20,18,27,57,1.0
People who aren<U+0092>t a twin don<U+0092>t understand the comparisons the world put on us from the second we pop out of the womb.,1,1,32,True,True,False,False,True,True,False,False,4176,4176,285,3068,8,9,21,6,1.0
People who speak English as a first language but from different countries are also confused by this,0,0,26,True,True,False,True,False,True,False,True,4176,187,318,94,9,39,93,162,1.0
Personally I make an effort.,1,0,77,False,True,True,False,False,True,True,False,50,187,214,10,20,17,8,17,1.0
"Personally, I<U+0092>d tell my mother.",1,1,46,False,False,True,False,True,False,False,False,858,787,4176,11,17,8,9,41,1.0
"Please continue to help her through this time, it's so important to have someone like you in her life.",1,1,40,False,False,False,True,False,False,False,True,858,4176,3068,907,18,9,11,22,1.0
Please don't let this person do that to do.,0,0,66,True,True,False,False,True,True,False,True,106,71,415,3068,86,35,22,35,1.0
Please know this is coming from a good place.,1,1,24,False,False,False,False,False,True,False,False,4176,741,318,3068,9,31,26,10,1.0
"Plus I'm sure your parents love being able to spend time with their grandkids, so everyone wins here!",0,0,105,False,True,False,True,False,True,True,False,858,162,4176,60,60,89,10,21,1.0
Polyamory is complex and not just you wanting to be with other people while keeping your primary relationship.,0,0,53,True,True,False,True,True,False,True,False,4176,187,214,89,8,205,7,138,1.0
Polyamory isn't threesomes or sharing yourself sexually with other people.,0,0,53,False,False,True,True,True,False,True,True,4176,285,3068,168,9,21,10,13,1.0
Power of Attorney is invalid after death.,0,1,79,True,True,True,False,False,False,True,False,858,741,4047,231,17,22,7,21,1.0
Pretty sure folks over there would appreciate it.,0,0,58,True,False,False,True,True,False,False,True,858,3068,847,429,19,6,22,61,1.0
Pretty sure OP's gf could report it without getting busted.,0,0,25,True,True,False,False,True,False,True,False,787,4176,214,99,8,8,11,18,1.0
Probably better not that seems like the type of thing that would piss him off but thanks for the suggestion.,0,1,117,True,False,True,True,False,True,False,True,858,60,4047,94,10,20,7,102,1.0
"Protect you, your child and your sister.",0,0,32,False,True,True,True,False,True,True,False,106,4047,231,3068,150,7,21,8,1.0
Pure love like this is a beautiful thing and people will be able to feel and see it radiating from you - they may be more understanding than you think :),0,0,40,False,True,False,True,False,True,True,True,858,106,153,10,16,75,13,71,1.0
"Put some separation between him and you, either locking yourself in the bathroom or going to take a long walk.",0,1,46,True,True,True,True,True,True,False,False,787,106,4047,62,9,48,14,44,1.0
Question: what are you going to do during these times to have fun?,0,0,35,False,False,True,True,False,True,False,True,858,787,4176,238,19,9,9,64,1.0
"Realistic or not, and honestly, I think he has the potential to do just that, I loved that I was able to show him something that he saw as worth striving for.",0,1,27,False,True,True,True,False,False,True,False,858,858,787,4176,15,71,13,10,1.0
"Realizing now that he's still, ""with,"" you, yet effectively cheating on you 24/7.",1,1,95,False,False,False,True,False,False,False,False,858,187,483,3068,18,102,7,5,1.0
Reddit is a place of goodness.,0,1,31,True,False,False,True,False,True,False,False,858,787,234,4047,18,8,16,8,1.0
"Remember your children will look to you as an example of how to build a life and you should actually have ""a life"" to show them.",0,0,25,True,True,False,True,True,True,False,True,4176,285,94,3068,10,19,241,6,1.0
"reminds me of a time when I was in my teens when some little girls yelled at me &amp; my friend for ""sitting in their seats"" in an almost-empty  3000-seat hockey rink.",0,0,126,True,True,True,False,False,False,True,True,187,4047,483,285,28,6,10,16,1.0
"Reminds me of Zenyatta's line from Overwatch:  ""I am on fire, but an extinguisher is not required!""",0,0,43,True,False,True,True,True,False,False,True,787,129,549,3068,8,14,24,5,1.0
Resentment festers and is toxic for everyone.,0,0,121,True,True,True,False,True,False,True,True,858,106,60,238,12,26,16,92,1.0
S clearly decided that R's protection was not enough.,0,1,26,True,False,True,True,True,False,False,False,787,106,3068,82,10,15,6,16,1.0
"Saw her at a grocery store with her new man, we made eye contact but she just kept going, and I lost it.",1,1,25,True,False,False,False,False,True,False,False,858,787,67,337,17,8,25,21,1.0
Saying all that immediately after receiving satisfying oral is totally rude and un called for.,1,1,53,False,True,True,False,False,True,False,False,787,106,187,3068,8,49,22,27,1.0
"Second, you are no longer attracted to your girlfriend.",0,0,69,True,False,True,True,True,False,False,True,858,3068,159,128,19,7,13,54,1.0
"See this Wikipedia article: https://en.m.wikipedia.org/wiki/Penis_captivus  As you can see, there is even a Latin name that is pretty erm, captivating.",0,0,36,False,True,False,True,False,True,False,True,858,89,231,3068,82,56,29,6,1.0
"Shame your father, but MOST importantly, shame your mother.",1,0,39,False,True,False,False,True,True,False,True,858,4176,74,106,16,9,62,20,1.0
Shaped his shit up fast.,0,0,38,False,True,False,True,False,True,False,True,4176,234,496,3068,10,17,18,6,1.0
She's already at the gym every morning.,0,1,54,False,True,False,True,False,True,False,True,858,4176,3068,557,20,10,6,6,1.0
"She's treated at least one person like crap, I'm sure...",1,1,38,False,False,True,False,False,False,True,False,858,741,318,231,13,31,75,26,1.0
"She adds an accent, accentuates hand marks, and makes me sound like an angry child.",0,0,26,False,True,False,True,True,False,False,True,4176,845,231,3068,9,3,34,6,1.0
She called me 5 times at work.,1,1,32,False,False,False,False,False,False,False,False,858,4176,741,3068,15,10,24,6,1.0
"She came back a few years later, with a new husband and a new child.",0,1,55,False,True,True,False,False,False,False,False,858,787,4047,3068,15,8,7,6,1.0
She doesn't need another blow right now.,1,1,52,False,False,True,False,False,False,True,False,858,169,3068,2261,20,17,6,19,1.0
She doesn't really do small things for me.,0,1,57,True,False,False,True,False,False,False,True,858,106,845,3068,40,63,6,6,1.0
She has already shown a willingness to throw away your relationship.,0,0,83,True,False,True,True,False,True,True,True,512,4176,4047,231,23,9,12,17,1.0
She has lost all control I her life now and there will be so many questions she needs answered.,0,0,28,True,True,False,False,True,True,False,False,231,3068,429,267,29,5,49,27,1.0
"She is my great-grandmother, making her my mom's grandmother.",0,1,89,True,False,True,True,False,False,False,True,787,231,3068,109,8,22,6,22,1.0
She is not your responsibility to take care of.,0,0,24,False,True,True,True,False,True,True,True,106,3068,55,299,12,11,34,20,1.0
"She isn't blameless, but you can hardly pin *all* of this on her, especially considering we only have one side of the story.",1,0,40,False,True,True,False,False,True,False,True,858,512,4176,285,55,20,9,20,1.0
She likes it from the left and I like it from the right.  /s,0,0,93,False,True,True,True,False,True,True,True,106,39,285,15,94,18,20,113,1.0
"She LOVED school growing up and at 19, is just an all around awesome, creative, responsible person and we have a great relationship!",1,1,84,True,False,False,False,False,False,False,False,4176,187,4047,199,10,70,7,58,1.0
She might need some help to get through whatever it is she is going through.,0,0,27,False,True,False,True,True,True,False,True,4176,7,3068,19,8,22,6,32,1.0
She needed you man and you failed miserably.,1,0,26,False,False,False,False,False,True,False,True,858,257,45,3068,17,18,22,13,1.0
"She proceeded to get herself sectioned, at which point she was diagnosed as bipolar.",1,1,29,False,False,False,True,False,False,False,False,858,50,3068,62,16,29,20,38,1.0
"She says it's difficult, but trusts his judgement.",1,1,36,False,False,False,True,False,False,True,False,858,4176,4047,62,5,9,10,48,1.0
She stays with another man now.,0,0,64,False,False,True,True,False,False,True,True,50,4176,299,159,23,9,20,14,1.0
"She teared up, just a little, and asked ""Can I hug you?",1,0,43,True,False,True,False,False,True,True,False,858,415,169,472,83,36,37,31,1.0
"She wanted a low key affair, I wanted a big wedding.We agreed on a big wedding.",0,1,31,False,True,True,True,False,False,True,False,4176,285,55,1098,9,25,17,52,1.0
"She was already left completely helpless and taken control of by this man, you don't want to perpetuate the feeling by making extremely personal decisions for her.",1,0,106,False,False,False,False,True,False,True,False,4176,3068,10,267,9,49,33,26,1.0
"She was my first real love in life, and when she chucked me over it broke my heart.",1,1,41,False,False,True,False,False,False,False,False,858,787,214,285,23,10,9,19,1.0
She was nice in a goofy way.,1,0,26,False,False,True,True,False,False,True,True,858,4176,3068,413,7,9,10,12,1.0
She wasn't a doormat in any way; she just didn't encourage anger and resentment.,1,1,90,False,False,False,True,False,False,False,True,858,50,3068,386,18,35,25,34,1.0
She<U+0092>s getting what she wants and as soon as the gravy train ends shits gonna got the fan again and it<U+0092>s just a rollercoaster ride from hell.,1,1,84,False,True,False,False,False,True,True,False,4176,3068,1671,720,9,5,12,9,1.0
She<U+0092>s trying to justify her situation by saying she wasn<U+0092>t the one cheating.,1,1,29,False,False,True,False,False,False,False,False,787,102,285,3068,9,11,19,6,1.0
"Shit happens, if both your husband and friend are okay afterwards and your relationships remain the same then just accept that this happened and try to move on from it like you would any other unexpected event.",0,1,69,True,True,False,True,True,False,False,False,4176,4047,285,1098,11,5,21,79,1.0
Shoot him down and be an asshole about it.,0,1,113,True,False,True,False,True,False,False,False,858,4176,285,3068,33,10,18,7,1.0
Show her how truly sorry you are.,0,1,28,True,False,True,False,False,False,False,True,858,787,4176,1310,15,8,10,24,1.0
Simple and the kids love it.,0,0,29,False,True,True,True,True,True,False,False,787,16,84,60,8,60,14,47,1.0
Single mothers are all whores.,1,1,120,False,False,True,False,False,False,False,True,787,4176,3068,562,9,9,13,86,1.0
So drunk that apparently the bar owner didn't think it was okay to even put her in the back of a cab.,0,0,79,True,True,True,True,False,True,True,False,858,858,4176,187,21,13,9,34,1.0
"So many other guys can't wait,  I guess.",0,0,28,True,True,False,True,True,False,True,True,787,4176,153,299,8,10,10,28,1.0
So people may grasp at something to talk about and go with it.,0,0,66,True,True,False,True,True,False,True,True,858,4176,94,429,16,9,17,58,1.0
So please get started soon.,0,1,55,False,False,True,True,False,False,False,True,858,787,96,3068,18,9,29,8,1.0
So they both saw a lot of death already and killed a lot of people themselves.,0,1,36,True,True,False,True,False,True,False,False,858,787,4047,106,86,8,19,25,1.0
So we ended up at gay bars quite a bit.,0,1,108,False,True,True,False,False,False,False,False,169,3068,45,62,23,5,41,38,1.0
"So we go to the play, and the production was amazing.",1,1,53,False,False,False,False,False,False,True,False,858,741,3068,19,22,22,14,96,1.0
So who the hell is supposed to help?,1,0,56,False,True,False,False,True,True,False,True,285,231,238,3068,20,18,23,5,1.0
"So, if parent X makes $40,000 and parent Y makes $60,0000, they will end up with a 40/60 split in terms of what they are each required to contribute to raise the child at that their combined income level (as if they were a single household with $100,000/year income).",1,1,41,False,False,False,False,False,False,False,False,858,483,318,3068,16,4,22,7,1.0
"So...she cheated on you with some dude who offered her money to fuck him and it's kind of a no brainer that you should break up with her, man.",0,0,26,False,True,False,True,False,True,False,True,4176,2,94,3068,9,57,106,5,1.0
Some asshole is cutting onions around me right now.,1,1,24,True,True,False,False,True,False,False,False,787,4176,415,3068,8,9,39,8,1.0
Some just flat out don't want anything to do with kids.,1,1,79,False,True,False,False,False,True,False,False,4176,3068,429,720,9,15,18,10,1.0
Somebody won<U+0092>t stop until they want to stop.,0,0,26,False,True,True,True,True,False,True,True,787,4176,285,74,8,9,41,20,1.0
Something I'm noticing anecdotally and even hearing about in recent studies is that we millennials don't have the kinds of networks our baby boomer church going parents did.,0,0,52,False,True,True,False,False,True,True,True,858,483,285,472,32,7,24,24,1.0
"Sometimes it's fast, but it makes sense.",0,1,33,True,False,False,True,True,False,False,False,858,483,3068,472,10,4,6,14,1.0
Sometimes people shouldn't have kids do.,1,1,31,True,False,False,True,True,False,False,False,4047,85,285,3068,8,18,30,5,1.0
Sounds like you are better off distancing yourself from that side of the family for your own mental and financial well being.,0,1,44,True,True,True,True,True,False,False,True,858,4176,58,187,54,10,39,234,1.0
Source -just filed for divorce,0,1,29,True,True,False,False,False,True,False,False,787,4176,4176,242,8,9,10,15,1.0
Source: Every Man's Battle by by Stephen Arterburn and Fred Stoeker.,1,1,38,False,False,True,False,False,False,True,False,4176,318,106,3068,10,41,12,5,1.0
Stay open and honest and keep up the friendship within the relationship. :),1,1,37,False,True,False,False,False,True,False,True,858,11,3068,19,13,39,7,20,1.0
"Stay together, split up, try a poly or some other form of <U+0093>open marriage<U+0094>.",1,0,61,True,False,False,True,True,False,True,True,472,4176,3068,2261,13,9,7,20,1.0
Staying in a marriage that isn't working won't make the parents or the kids happy.,1,1,55,False,False,True,False,False,False,True,False,858,231,3068,172,17,22,5,19,1.0
Stepdad will be the one walking me down the aisle when I get married.,1,1,52,True,False,False,False,True,False,False,False,102,4176,318,3068,15,9,33,7,1.0
Stress responses prove previously unforeseen incompatibilities.,0,1,31,True,False,False,True,False,False,False,True,787,4176,35,3068,8,9,16,7,1.0
"Supporting people is helping them to be their best selves, not congratulating then for shopping out the shitty high school hurt feelings version.",0,0,24,False,True,True,True,False,True,True,True,858,285,106,2261,9,20,18,700,1.0
"Sure will, about to take a long bath and cuddle a little bit, my husband came down with a fever tonight.",0,1,30,True,False,True,True,False,False,False,False,858,787,4176,318,119,8,9,39,1.0
Tell him <U+0093>I love you but our sex life is making me consider leaving you.,0,1,85,True,False,True,True,True,False,True,False,4176,4047,231,299,9,7,29,49,1.0
Thank you for doing this and I really hope you guys can make it all work.,0,0,82,False,True,True,True,True,True,True,False,4176,4047,285,337,10,7,17,23,1.0
"Thank you for sharing your story, if only anonymously.",1,1,48,False,False,False,True,False,False,False,False,858,4176,4047,3068,16,10,17,7,1.0
thank you for taking the time to respond.,1,0,103,False,False,False,True,False,True,True,False,4047,169,845,231,25,22,2,17,1.0
Thank you for your kind words!,0,0,102,True,True,False,False,True,False,True,False,787,4176,3068,472,9,8,6,26,1.0
"Thank you, long numerical name internet stranger.",0,0,62,False,False,True,True,False,True,False,True,858,787,49,169,18,8,54,25,1.0
"Thanks for answering, I was actually curious",1,1,50,True,True,False,False,False,False,False,False,858,214,4047,1,16,8,8,54,1.0
That's almost a Chandler / Monica story.,0,0,72,True,True,True,True,False,False,True,True,787,4047,28,414,8,7,13,34,1.0
That's unhealthy.   &gt; She later told me that she would kill herself if we didn't get married within 2-3 years of being in a serious relationship.,0,1,118,True,False,True,True,False,True,True,False,858,858,4176,2261,217,19,10,26,1.0
That's why I called the police.,0,1,71,True,False,True,False,False,False,False,False,858,4176,4047,483,16,11,8,5,1.0
that doesn't sound like a healthy relationship to me. not wanting you to be friends with other guys is definitely a red flag.,0,0,24,True,False,False,True,True,True,True,False,106,4176,4047,153,35,9,10,19,1.0
That is incredible and I'm glad that you experienced exactly what I'm feeling right now.,0,1,133,False,False,True,True,False,False,False,False,4176,187,214,3068,10,134,9,6,1.0
That is my current goal.,1,1,132,False,True,False,True,False,True,False,False,858,60,3068,1098,128,88,6,48,1.0
"That is when they both looked at each other, had this sly smile on their face, and seriously asked if I would be OK dating them both.",1,1,58,False,False,False,True,False,False,False,True,858,4176,234,3068,17,9,34,9,1.0
That part of the country is known for having lots of hippies and free spirits.,0,0,25,True,True,True,True,True,False,True,False,787,162,4176,845,9,37,9,2,1.0
That usually doesn<U+0092>t go super well.,0,0,25,True,True,False,False,True,False,True,True,106,96,4176,43,76,25,9,16,1.0
That was after the break she initiated.,0,0,24,True,True,True,True,True,True,False,True,787,472,231,106,8,14,27,14,1.0
"That was SUPER long, but a really good read.",1,1,61,False,True,False,False,False,True,False,False,50,285,3068,359,25,18,8,18,1.0
That we made a choice based on lies and deceit?,1,1,84,True,False,True,False,False,False,False,False,858,165,4047,3068,29,56,7,7,1.0
"That<U+0092>s what messes with me, we<U+0092>re both going though this over something he didn<U+0092>t really have any control over.",1,1,78,True,True,False,False,True,False,True,False,4176,15,169,3068,9,55,24,6,1.0
"The ""tutorial"" had an astronomical level of sass  EDIT: A thing I forgot to add is that I have googled it in the incognito mode of Chrome so nobody in the house could ever find out that I had to look that up on the internet",0,0,114,False,True,False,True,False,True,False,True,858,71,3068,109,16,25,5,23,1.0
The Affordable Care Act stopped that from happening.,0,1,34,True,False,True,True,False,False,True,False,858,787,106,4047,18,9,47,21,1.0
The best decision in this entire story was made by the grilfriend.,0,1,63,False,True,False,True,False,True,False,False,858,4047,231,3068,47,12,23,6,1.0
The best response to that is <U+0093>damn I guess you should have had more then.<U+0094>,0,1,90,True,True,False,True,False,True,False,False,858,858,787,285,19,19,11,25,1.0
The bites the lack of vaccinations and everything else is in our ASPCA and police reports.,0,0,55,True,True,True,True,False,True,True,True,106,4176,111,557,173,9,45,97,1.0
The comments have since stopped.,0,0,59,False,True,True,True,False,True,True,False,4176,3068,429,62,8,6,38,40,1.0
The consequences should be that she goes through the pregnancy alone.,0,1,43,False,False,True,True,True,False,True,False,858,858,4176,429,16,42,9,28,1.0
The conspiracy is huge spanning centuries they have even gone back in time and changed the information in libraries to prove you wrong... science itself cannot be trusted.,1,1,37,False,False,True,False,False,False,False,False,858,787,483,3068,18,8,5,5,1.0
The Dravidian languages are more different from the Indo-European languages than Hindi is from English.,0,0,33,False,True,True,True,False,True,True,True,67,4176,231,3068,16,10,28,5,1.0
The elders did home visits weekly which lead to my mom being labeled a bad wife and mother and we were banned from the kingdom hall until she shaped up.,0,1,24,True,False,True,True,False,True,False,False,787,4176,45,847,8,9,34,24,1.0
The fact that he hasn't demanded that of his children speaks volumes.,1,1,29,True,False,False,True,False,False,False,False,787,318,3068,1098,8,51,5,39,1.0
The first time was a little unclear as to rather it was intentional or a form of misunderstanding.,0,0,31,True,False,True,False,True,False,True,False,4176,1310,231,55,9,23,29,21,1.0
"The guy waited there for like 2 min like ""can I get a turn"" before moving on.",0,1,133,True,True,False,True,True,True,False,False,262,231,3068,423,25,24,7,10,1.0
The mentality is old and tired.,0,0,26,False,True,True,True,False,True,False,True,858,395,4176,285,6,17,8,18,1.0
The more I gave the less I had to give over time.,1,1,39,False,False,False,False,False,False,False,False,858,50,102,3068,18,28,15,6,1.0
The next step is to simply be there for your wife.,0,0,106,True,False,True,True,False,True,True,True,60,4047,26,819,129,9,41,5,1.0
"The only complaint they've ever voiced is that their steaks are too cooked, but they're still good.",0,1,25,False,True,True,True,False,True,False,False,787,4047,3068,386,12,34,8,119,1.0
The only thing you'll get in a life is opportunities and the freedom to make respond to them.,0,0,54,True,True,False,False,True,False,True,False,787,234,285,25,8,30,21,121,1.0
The party that introduced all the kids in his class and was so much fun never happened again.,0,1,137,True,True,True,False,False,True,False,False,858,4176,4047,285,76,9,9,19,1.0
The reason I'm still here is that I'm *letting* him abuse me to the point that my health has failed and I'll probably die well before he does.,1,1,28,False,False,False,True,False,False,False,False,858,4176,214,3068,15,9,9,6,1.0
The road to redemption comes one step at a time.,1,1,90,True,True,False,False,False,False,False,True,787,4176,94,3068,8,9,19,5,1.0
"The satisfaction isn't instant, but over a grueling amount of time of working at it.",0,0,46,False,False,True,True,False,False,True,True,858,395,285,3068,34,21,18,6,1.0
The system that lets people associate speaking with AAVE to ghetto.,0,0,54,False,True,False,True,True,True,False,True,4176,234,3068,368,10,25,7,13,1.0
The upshot of this is that everyone knows what pains you.,0,1,89,True,False,False,True,True,False,False,False,106,4047,496,285,81,6,16,18,1.0
The whole <U+0093>Think of your kid<U+0094> is just a way to guilt you.,0,1,33,True,False,False,True,False,False,False,False,858,858,4176,3068,17,16,10,6,1.0
Their response: ummm... yeah..  but you'll feel more at ease!,0,1,38,False,False,True,True,False,False,False,False,858,106,4176,4047,231,79,9,8,1.0
Then I lick her from head to toe and ass.,0,1,48,False,True,False,True,False,True,True,False,858,169,106,3068,19,26,47,6,1.0
Then I met who I call my recovery boyfriend.,0,1,34,False,False,True,True,False,False,False,False,858,787,512,3068,16,8,39,5,1.0
Then slap my ass and call me Randy because I must be a homosexual,0,0,25,False,True,True,True,True,False,True,False,787,231,299,337,8,33,31,20,1.0
"Then when you see someone who's vulnerable/in pain/emotional and is being bullied, you go help that guy out and stand with him.  90% of reddit will support OP but one person come up and judges you, and you'll forget about the 90% of redditors who supported you.",0,0,24,False,False,True,True,True,True,False,True,787,4176,472,368,8,9,14,19,1.0
"Then, they got married and the controlling or abuse started.",0,1,50,True,True,False,True,False,False,False,True,4176,129,3068,153,10,39,8,11,1.0
There's a hard core truth in life: each of us walks his or her own path in life alone.,0,0,24,True,False,False,True,False,True,False,True,787,4176,3068,847,8,9,5,16,1.0
There's an app called Musi that does this too,0,0,31,True,False,True,True,False,True,True,True,787,4176,62,557,11,9,43,7,1.0
"There's no history of Down's Syndrome in my family, but my little brother has Down's.",0,1,39,False,True,True,False,False,False,True,False,787,4176,3068,359,9,12,10,20,1.0
"There's no playing games together anymore, because he doesn't want to play any of our games.",1,0,36,False,False,False,False,False,True,False,True,858,4176,4176,3068,17,11,8,7,1.0
There's no point in everyone in the family being a mess.,0,1,41,False,True,False,True,False,False,False,False,858,858,787,3068,15,16,8,9,1.0
"There's not really much comfort after a death, there's just pain to process.",0,1,56,True,False,False,True,False,False,False,False,787,4176,4047,3068,9,9,12,8,1.0
There's nothing cute about a panic attack on that leaves me crippled on a super market floor for 2 hours.,1,1,42,False,False,False,False,False,False,False,True,858,318,3068,562,18,38,5,22,1.0
"There are no witch hunts.   - The dude is apparently exactly being investigated, as he should be.  - He is also not named here, so it's not like ""the public"" has a fucking clue.",0,0,43,False,False,True,True,False,True,False,True,787,483,169,148,7,4,33,51,1.0
There are ways of processing that or even just <U+0093>getting it off your chest.<U+0094>,0,0,38,True,False,True,False,True,False,True,False,4176,148,3068,62,10,47,8,45,1.0
There can be many good reasons to leave someone.,0,1,79,True,False,True,False,False,False,True,False,4176,4176,3068,337,8,9,17,55,1.0
There is just that heavy air of it whenever I see guys around girls in games.,1,1,43,False,False,True,False,False,True,False,False,858,4047,318,414,16,11,37,48,1.0
"There is no reason he should be getting grinds in his cup, and the aeropress absolutely doesn<U+0092>t need to dry between uses.",0,0,111,False,True,True,False,False,True,True,False,858,13,472,414,17,102,13,41,1.0
There really needs to be a conversation between you two because to me that's betrayal.,0,1,128,True,True,True,False,False,False,False,False,858,4176,4047,3068,15,10,6,12,1.0
