full_text,Emotional_disclosure,Information_disclosure,score,emo_disc.1,emo_disc.2,emo_disc.3,emo_disc.4,info_disc.1,info_disc.2,info_disc.3,info_disc.4,Throughput.1,Throughput.2,Throughput.3,Throughput.4,WorkTime.1,WorkTime.2,WorkTime.3,WorkTime.4,popularity
"You mention that looking into fixes for this has been a ""major past-time"" for a while now.",0,0,53,False,False,True,True,False,False,True,True,858,234,129,285,17,27,18,36,1.0
"You must a patient lady if you could argue with a drunk guy for 3 hours <U+0001F602> Of coarse it's normal, unless you turn into a <U+0001F608> for a few days lol.",0,1,36,False,True,True,False,True,False,False,False,102,4176,4047,169,11,10,71,24,1.0
You need a new start.,1,1,58,False,False,True,False,False,False,False,False,4176,4047,483,3068,10,8,7,6,1.0
You need to decide if you are boring or not.,0,0,60,True,True,True,True,True,True,False,True,787,106,285,562,7,41,19,10,1.0
You need to figure that out,0,0,37,True,True,False,True,True,True,False,True,16,483,29,3068,46,4,28,6,1.0
You need to pack your bags and go to that honeymoon.,0,0,104,False,True,True,True,False,True,False,True,787,483,169,845,8,3,18,2,1.0
You never know if the gal who bought $10 worth of services or products will refer $1500 worth of services in her friends and family.,1,1,35,False,False,False,True,False,True,False,False,858,4176,60,483,20,9,50,6,1.0
You people should spread that good shit.,0,0,29,True,False,True,False,False,False,True,True,4176,25,3068,429,11,31,7,34,1.0
You say that those memories and feels will fade.,1,0,71,False,True,False,True,False,True,True,True,13,3068,429,10,49,5,18,27,1.0
You sound a lot like me.,0,1,56,True,True,False,True,False,True,False,False,787,231,25,1098,8,20,116,40,1.0
You stood by her and made her final days count.  you're one of the good ones &lt;3,0,0,51,True,False,False,True,True,False,True,True,4176,55,3068,429,9,38,10,46,1.0
You were talking to another guy when I first met you!,1,1,46,False,False,True,False,False,False,False,False,858,4176,318,3068,15,8,24,13,1.0
You will walk in peace again.,1,0,28,True,False,False,True,False,True,False,True,858,787,395,34,20,8,17,33,1.0
"You write in a ""voice"" very similar to my own.",0,1,26,True,False,True,True,True,False,True,False,4176,3068,55,173,9,7,65,80,1.0
You<U+0092>re doing a good thing OP.,1,0,25,False,True,False,False,False,True,True,False,858,4176,55,472,7,9,36,24,1.0
"Your dad is a POS, and you clearly have a much more accurate moral compass.",1,0,26,True,False,False,False,True,True,True,True,85,285,413,153,22,23,29,34,1.0
Your family is your wife and son. your sisters need to understand that when you moved out and got married you and your wife became a separate family unit with your own schedule.,1,1,27,False,True,False,False,True,False,False,False,858,787,4176,114,15,8,10,97,1.0
Your now ex-boyfriend never apologized to you.,1,1,28,False,True,False,False,False,True,False,False,102,4176,60,3068,11,10,16,14,1.0
"Your story has me in tears, thank you for sharing.",1,0,33,False,False,False,False,False,True,False,True,4176,483,318,3068,9,7,44,8,1.0
"""Oh, I had a bad day at work today, I'm so depressed!""",1,1,51,False,False,False,False,True,False,True,False,106,4176,106,2261,55,9,31,73,1.0
&gt; just know that not every white person is racist and that there are people that are valiantly defending you and sticking up for you when you're voice isnt being heard or if some asshole says something.,1,1,54,True,True,False,False,True,False,False,False,787,4176,741,285,8,9,25,24,1.0
"&gt;You are the mom you never had  Wow that hit a chord for me, thank you for that.",1,1,66,False,False,False,False,False,False,False,False,4176,262,285,3068,9,20,20,8,1.0
"*hugs* I lived your alternate reality and I am so, so proud of you for being strong enough, and wise enough, and brave enough to make the choice that was best for YOU in spite of what was said to you.",1,1,25,True,False,True,False,False,False,False,False,4176,741,129,85,10,17,39,17,1.0
"A lot of people are saying to get a lawyer yet at this point in time, where the wounds are still fresh, I hope to know that you don't blame yourself for this.",1,0,82,True,False,False,False,False,False,False,False,858,165,4047,3068,89,64,7,5,1.0
"After all, we all deserve to be happy.",1,0,38,True,False,False,True,True,False,True,False,858,512,153,10,15,34,7,42,1.0
"All but one expected me to ""come out of the box"" like their ""Dream Woman"", when shit got tough, they bailed the fuck out.",1,1,28,False,False,False,False,False,False,False,True,858,512,106,153,16,29,26,18,1.0
Also - apologise to your wife for not taking her seriously.,1,1,49,False,True,False,False,False,False,False,True,858,787,39,285,14,8,18,17,1.0
"Also, I have a new appreciation for my pants that don't have pockets.",0,1,74,True,False,True,False,True,False,False,False,1306,187,4047,285,17,48,6,26,1.0
"An ER doctor can request a 72 hr hold, you can go to the court with whatever your state requires and write out what is happening with your daughter and a judge will decide if she needs in patient treatment.",0,1,53,False,False,True,False,False,False,False,True,787,4176,483,3068,11,10,7,5,1.0
"And even if we can<U+0092>t have sex right at that moment, or even that night (we have 3 kids which seriously affects our sex life), it makes my wife happy to know that she turns me on.",1,1,82,True,True,False,True,False,False,False,False,4176,4047,413,429,9,58,14,144,1.0
And fight for your sister's sake.,0,1,31,False,True,False,True,False,True,False,False,858,285,106,238,16,21,19,55,1.0
And it could be very harmful to fill her head with further ideas that she<U+0092>s the victim.,0,1,34,False,True,False,False,False,True,False,False,858,4176,483,231,17,9,5,33,1.0
And keep on eye on any money in a joint account.,0,1,50,False,True,True,False,False,False,True,False,787,4176,169,318,9,9,18,35,1.0
And keep on eye on any money in a joint account.,0,1,50,False,True,True,False,False,False,True,False,787,4176,169,318,9,9,18,35,1.0
"And know that one day you will be at peace with this episode in your life, and that it'll all get better from here.",0,1,48,False,True,False,True,False,True,False,True,858,257,1310,285,6,30,20,18,1.0
And make sure she knows that you believe and support her above anything (especially because you blew it off initially when she told you).,0,1,106,True,True,False,True,False,False,False,True,858,4176,318,386,32,9,20,33,1.0
"And please don't forget to smile and show others you are happy, there is someone in there who wants to take the world by storm.",0,0,60,False,False,False,False,False,True,True,True,4176,3068,10,13,9,64,32,38,1.0
And you are worthy of respect!,1,0,42,True,False,False,False,True,False,True,True,858,4176,169,368,23,8,16,10,1.0
As a black man I hope you don't resent us for the crimes of one.,1,1,63,False,False,False,False,True,False,False,False,106,3068,13,429,57,5,24,81,1.0
"As a semi-successful son, I'd have to say, sadly, my dad didn't make many of such jokes.",1,1,133,False,True,True,False,False,True,False,False,858,50,285,13,19,30,27,39,1.0
"As much as I adore the people in my life, there's no one who is going to love you more than the love you can give yourself.",1,1,30,True,False,True,False,False,False,True,True,787,4176,242,3068,10,10,42,10,1.0
"At the end of the day, you're going to have to figure out a way to get him to speak candidly with you about your sex life.",0,1,121,True,True,True,False,False,False,False,False,787,4176,4047,3068,9,10,8,6,1.0
Being brave and being honest about our dark feelings can really be liberating and the first step to healing.,1,0,29,False,False,False,True,False,True,True,False,858,16,4176,153,9,89,10,10,1.0
"Being homeless, I obviously had no insurance or access to mental health services, and she provided me with all the information I needed for receiving free mental health services in my city.",1,1,114,False,True,False,True,False,False,False,False,858,4176,285,413,17,9,21,18,1.0
"Being mean for the sake of it because of his weight wouldn't be cool, but talking to him about your legitimate issues with his smell is not body shaming.",1,1,28,False,True,False,False,False,False,False,True,858,4176,4176,3068,15,8,10,4,1.0
Best decision I've ever made.,1,1,28,False,True,False,True,True,False,False,True,787,4176,106,2,7,10,33,48,1.0
Best of luck to you!,0,1,47,True,False,False,True,False,False,True,False,858,787,4176,4047,5,8,8,13,1.0
Best of luck to you!,1,0,47,True,False,False,True,False,False,True,False,858,787,4176,4047,5,8,8,13,1.0
Best of luck to you.,0,0,47,False,True,True,True,False,False,True,False,858,165,4176,152,17,56,10,70,1.0
Best of luck to you.,1,0,47,False,True,True,True,False,False,True,False,858,165,4176,152,17,56,10,70,1.0
Best of luck to you.,1,1,47,False,True,True,True,False,False,True,False,858,165,4176,152,17,56,10,70,1.0
But for right now she's with another guy.,0,1,52,True,False,False,True,True,False,False,False,4176,285,845,106,9,24,6,14,1.0
"But I used to be pretty uncomfortable being alone in high school though, but the big break through for me was just spending time getting to know myself without any external influences.",1,1,34,True,False,False,False,True,False,False,False,858,67,4176,231,14,16,9,32,1.0
But I woke up every morning to find my mask AND CPAP machine in a whole different position as if I pulled the mask off and THREW it as hard as I can.,0,1,25,True,True,False,False,False,False,False,False,787,787,43,3,61,8,34,25,1.0
But it doesn't change the fact that infowars is a vile website that posts extremely dangerous information which is killing the old and young.,1,0,116,False,True,True,False,False,False,False,False,50,4176,37,4047,46,9,64,115,1.0
"But trust me, your efforts to include people are definitely noticed and appreciated for sure!",1,1,32,False,True,False,False,False,False,False,True,858,787,96,4176,66,8,21,10,1.0
But you've got to get him talking.,0,0,121,True,True,True,False,False,False,True,True,787,4176,262,285,9,10,19,24,1.0
But your neighbors were at fault more than you here.,0,1,78,True,False,True,False,False,True,False,False,4176,46,4047,2261,9,5,8,21,1.0
Couple of points for you:  You are making it worse with all the negative thoughts.,1,0,30,False,False,True,False,True,False,True,False,858,106,96,4176,7,38,18,9,1.0
Couple of points for you:  You are making it worse with all the negative thoughts.,1,0,30,False,False,True,False,True,False,True,False,858,106,96,4176,7,38,18,9,1.0
"Crazy story man, glad it all turned out ok.",1,0,52,False,False,False,False,True,True,True,False,169,231,2261,159,21,17,28,11,1.0
Cut the ties with the hurt and pain - it<U+0092>s a daily process.,0,0,32,False,True,False,True,False,False,False,False,858,787,4047,3068,16,8,11,8,1.0
"Didn<U+0092>t matter we were incompatible because for her to give me what I needed  was exhausting for her, she felt annoyed with it after mins and felt like work.",1,1,74,False,True,True,False,False,True,False,False,50,4047,25,429,40,13,88,27,1.0
Don't ever feel guilty about being with another man or just moving on.,0,0,73,True,False,True,False,True,True,True,True,1306,429,159,168,23,49,14,28,1.0
Education is a really important thing even if traditional college isn't for you.,1,1,29,True,False,False,True,True,False,False,True,858,89,318,285,19,38,37,17,1.0
"Either way, you have to be more direct and talk to him about it or your marriage will very likely be like this forever",0,1,46,True,False,False,False,True,False,False,False,4176,318,285,114,9,44,18,74,1.0
"Even if you never speak to her again, she will always remember you with fondness, because you didn't recoil from her but rather invited her into your car.",0,0,61,True,False,True,True,True,False,True,False,858,25,231,1098,16,13,31,40,1.0
"Facebook groups are your friend, but Facebook marketing is tricky and their algorithms change all the time.",0,0,35,False,True,False,True,False,True,False,False,106,4176,4047,3068,36,9,11,14,1.0
Feeling sorry for your partner can be a trap: making you feel guilty for standing up to his child abuse.,1,1,60,True,False,False,True,False,True,False,False,858,787,4176,483,21,11,8,5,1.0
"First kiss was like ""oh hello"".",0,1,31,False,False,False,True,True,False,True,False,16,4047,83,153,47,9,18,8,1.0
First off--I agree with the person above me that you guys need a divorce.,1,1,102,True,False,True,False,False,False,False,False,858,4047,187,3068,14,6,22,5,1.0
"First, your girlfriend is overweight which is unhealthy and expensive.",0,1,69,True,False,False,False,True,False,False,True,4176,483,1,159,10,4,63,16,1.0
"For example, my kid has a speech delay, didn<U+0092>t speak til 4, I was excited when he started saying certain phrases, another friend stomped on my excitement saying Oh, my LO has been saying that since she was 18 months!",1,1,24,True,False,True,False,False,False,False,False,3,787,153,173,78,12,19,21,1.0
"For me, my problems weren't always real problems.",1,1,40,False,False,True,True,False,False,True,False,4176,4047,285,3068,9,10,25,9,1.0
"For the ""you're not sending a picture because you're ugly"" it's just that the male feels bad about themselves after being declined and has to lash out.",1,1,47,False,False,True,False,False,False,False,False,787,4176,3068,114,10,9,8,88,1.0
For what it's worth he probably would have been very happy to know that you weren't distracted by him falling ill and that you were able to build the relationship with your husband.,1,1,47,False,True,False,True,False,False,False,True,858,787,472,4176,18,8,17,9,1.0
Friends don<U+0092>t crawl into your bed knowing you have a significant other.,0,1,63,True,False,True,True,False,True,False,False,858,787,483,169,60,9,7,22,1.0
"Getting cheated on feels terrible, there's no denying that.",1,0,27,False,True,False,False,True,True,False,False,318,153,2261,255,48,11,365,16,1.0
Glad you weren't robbed or killed or anything.,1,0,25,False,False,False,False,False,False,True,False,858,741,238,337,10,32,111,16,1.0
Go over your marriage vows and stick to them.,0,0,71,True,True,True,True,False,True,True,False,4176,187,121,2261,10,56,12,20,1.0
Go see a grief counselor.,0,0,37,True,False,True,False,False,True,True,False,787,512,231,3068,9,27,17,5,1.0
Good luck with your new life!,1,0,25,True,False,False,False,True,False,True,False,214,285,46,3068,7,21,32,13,1.0
Handleturning...that's very cute <U+0001F60A>  I've always been that person in relationships...paying more attention (read: being neurotic) and understanding the value of these small gestures.,1,1,110,False,True,True,False,False,True,False,False,4176,483,285,27,10,10,17,59,1.0
Hateful people often project their misery and failures back into the world.,0,0,44,False,False,True,True,False,False,False,True,858,4047,3068,472,17,10,7,18,1.0
He doesn't get to tell you what to do.,0,1,32,True,False,False,False,False,False,False,True,858,15,3068,13,33,143,5,27,1.0
"He may not be an all-bad guy but if he did this often enough to wear on your nerves, imagine it after 5 years. 10 years.",0,0,89,True,True,True,True,True,False,False,False,858,4176,4047,483,14,10,6,8,1.0
He might just be as nervous about all of this as you.,0,0,121,False,False,True,True,False,False,False,True,4176,4047,3068,557,9,6,9,5,1.0
Hearing him sob at night broke my heart.,1,1,33,False,True,False,False,False,False,False,True,4176,34,3068,62,9,14,5,65,1.0
"Her husband could still be alive, from what we understand - and my mom's siblings have the 50p  that she wrote for him ready and waiting.",0,1,36,False,True,True,True,False,True,False,False,858,257,787,4176,24,33,8,9,1.0
"Her husband could still be alive, from what we understand - and my mom's siblings have the 50p  that she wrote for him ready and waiting.",0,1,36,False,True,True,True,False,True,False,False,858,257,787,4176,24,33,8,9,1.0
"Hey man, I'm really sorry to read this.",0,0,124,True,True,True,False,False,True,False,False,858,214,4047,285,25,9,8,14,1.0
"His response: ""Red is looking at me and I just love him so much.""",1,1,50,False,False,False,True,False,False,False,True,106,4176,3068,562,108,9,8,381,1.0
"Honestly, I'm impressed by both of them.",1,0,72,False,True,False,True,False,False,True,True,25,4047,3068,111,16,5,8,20,1.0
Hope you're feeling better soon.,0,0,33,False,False,True,False,True,False,False,False,858,787,153,172,16,8,7,25,1.0
"Hope you are okay, and be well.",1,0,44,False,True,False,False,False,True,False,True,858,1,39,285,16,130,26,19,1.0
I'll be in the area this weekend if you need to get out or need someone to talk to just to get the weight off your chest.,0,1,69,True,False,False,False,True,True,False,False,4176,129,483,3068,9,29,10,6,1.0
I'm 23 and still have never been on a date.,0,1,141,False,False,True,False,True,False,True,False,1,4176,169,173,53,9,27,28,1.0
I'm a side sleeper and I have no problem with my mask.,1,1,53,False,False,True,True,False,False,False,False,858,3068,429,109,18,5,27,21,1.0
"I'm actually a morning person, so exhaustion isn't a problem for me, but I know I snore like a chainsaw, and this makes me wonder if I've just gotten used to the way I feel.",1,1,99,False,False,True,False,True,True,False,False,106,4176,128,10,48,8,27,33,1.0
I'm glad to hear it from another person as well.,1,0,70,True,False,False,False,True,False,True,False,858,102,285,845,27,12,20,2,1.0
I'm going to go home and treat my wife extra tenderly this weekend.,1,1,125,False,False,False,False,False,True,False,False,4176,285,62,359,9,21,29,16,1.0
"I'm happy to wait until they get here.""",0,0,76,True,False,False,False,False,True,False,True,858,787,34,845,36,10,17,3,1.0
"I'm not saying you shouldn't take some time to reflect about the relationship and what you want to do with your life now, but, with time the pain will ease, maybe only a little bit, but enough to be able to think about it without dark thoughts and questions  overwhelming you...",1,1,124,False,False,True,True,False,False,True,False,858,4176,285,7,17,9,24,212,1.0
I'm so glad you chose better for yourself.,1,0,77,False,True,True,False,True,True,False,True,512,60,55,4047,24,178,169,5,1.0
I'm so sorry that this happened to you.,0,1,40,False,False,True,True,False,True,False,False,787,496,483,3068,8,28,5,7,1.0
I'm so sorry that you are suffering.,1,0,29,False,False,False,True,False,False,True,False,858,4047,231,3068,88,8,20,21,1.0
"I'm sorry you have gone through this, remember, it's not your fault.",1,1,30,True,False,False,False,False,False,False,False,858,787,4176,285,4,9,8,21,1.0
I'm sorry your experience was so horrible.,1,0,27,False,False,False,False,False,True,False,True,4176,285,413,153,9,17,15,10,1.0
"I'm sure, in the future, he will never forget about how much you changed his life.",0,1,76,True,False,True,True,False,False,False,True,858,395,187,4047,39,20,27,29,1.0
"I've started gently correcting people: ""OCD is a really serious condition, like depression and any other mental illness - please don't use the term so lightly!"", and it makes a surprising difference!",1,1,101,False,True,False,True,True,True,False,False,858,285,15,148,15,23,132,35,1.0
"I've tried to do things like that before but what frustrates me is the findings of my ""experiment"" make no sense.",1,1,66,True,False,False,True,False,False,False,False,4047,285,3068,2261,9,19,8,24,1.0
"I  met her a couple of months before my sixteenth birthday, we dated for about eighteen months.",0,1,41,False,True,False,False,False,False,False,False,102,169,285,3068,12,34,22,7,1.0
I 100% agree with you on this.,1,1,75,False,True,True,False,True,False,False,False,858,4047,483,414,197,72,6,28,1.0
"I agree that now is better than later, but OP also please remember that you've experienced a loss that you are allowed to mourn that loss in whatever shape that takes.",1,0,116,False,True,False,False,True,True,True,False,4176,741,60,429,10,19,26,59,1.0
"I agree, some of these places need a change of staff, or some of their staff needs a change of heart.",0,1,38,True,False,False,False,False,False,False,False,858,4176,483,3068,17,9,5,9,1.0
I almost lost my son at birth and I was out of my mind.,1,1,30,False,False,False,False,False,False,False,False,858,4176,85,29,5,9,16,56,1.0
I also assumed that your brother and the girl were teenagers. 27 and 30 are not ages where this kind of behavior is acceptable.,0,1,97,False,False,True,False,False,False,True,False,858,106,285,3068,40,52,29,10,1.0
"I also just wanted to ask, you only mentioned medication as a treatment, have you tried others like neurofeedback?",0,1,31,False,True,True,True,False,True,False,False,787,106,3068,74,8,13,5,52,1.0
"I also think you should, with your GF and police permission, alert the website admin that there's a video of an underage girl.",0,1,33,True,False,False,True,False,False,False,True,858,4176,94,3068,21,10,156,11,1.0
"I also was married for almost 28 years, getting married at 18 years old.",0,1,26,False,False,True,True,False,False,True,False,858,3068,2261,337,6,6,22,19,1.0
"I am a non-black WOC but if you ever need to talk, you're welcome to PM me.",0,1,43,False,False,False,False,True,False,False,False,858,96,4176,3068,21,19,9,7,1.0
I am so incredibly sorry for your loss.,0,1,88,False,True,True,False,True,False,False,False,858,741,4047,169,23,17,21,17,1.0
I am so sorry for both of you.,1,1,34,False,True,False,True,False,False,False,False,787,4176,4047,8,8,9,7,46,1.0
I am so sorry this happened and I hope you can heal and find happiness really quickly &lt;3,1,0,45,False,False,False,False,False,False,False,False,4176,285,15,3068,9,27,107,6,1.0
I am sorry your brother was depressed.,1,0,45,False,False,True,False,True,False,True,True,858,285,368,10,28,17,9,22,1.0
I can't imagine what you went through but am sorry for your losses.,1,0,115,False,False,False,False,True,False,True,True,96,4176,60,159,45,10,105,12,1.0
I can<U+0092>t imagine how much relieving this is.,1,0,35,True,False,False,False,False,True,False,True,858,512,395,4176,28,17,50,8,1.0
I cheated on my wife for the measly two and a half years I was married to her.,1,1,64,False,False,False,True,False,False,False,True,60,169,18,562,25,24,36,18,1.0
I console him as best as I can because I know he's emotional and looped on pain meds and stress.,0,1,50,True,True,False,True,False,True,False,True,787,395,845,3068,8,25,3,8,1.0
"I created this account just so I could reply to you because your situation is so very much like mine was: married 13 years, no kids, having to hold their hand doing everything and going everywhere.",1,1,60,False,False,False,False,False,False,False,False,741,73,318,3068,18,28,46,6,1.0
"I don't know if this is the same thing but it's shocking enough and then life goes on ""as normal"" still afterwards so it's somewhat surreal.",1,1,142,False,False,True,True,False,False,False,True,4176,234,4047,22,8,42,13,122,1.0
"I don't know them but it sounds like they are just trying to bond with you, and the easiest way they know how is by going through the tropes of marriage and women.",1,1,27,False,False,False,False,False,False,False,True,858,67,4176,3068,5,33,9,6,1.0
"I don't know who you are or where you live, but please, don't give up.",1,1,25,False,False,True,False,True,False,False,False,787,106,4176,741,9,44,10,24,1.0
I don't think you have to be as dramatic about it as this guy.,1,1,56,False,True,True,False,False,False,True,False,858,787,42,169,5,8,22,22,1.0
I feel like some people need to be told it's ok to divorce.,1,1,29,True,True,False,True,False,False,False,True,858,858,4176,1306,13,22,9,24,1.0
I feel like some people need to be told it's ok to divorce.,1,1,29,True,True,False,True,False,False,False,True,858,858,4176,1306,13,22,9,24,1.0
"I get out and about and love traveling, but there's times I'm debilitated for weeks or months at a time when it flares up.",0,1,86,True,True,True,False,False,False,False,False,102,4047,231,10,12,7,34,23,1.0
I had been doing 80 in the 70.,0,1,43,True,False,True,True,False,False,True,True,787,1,512,89,10,46,22,29,1.0
"I have put out feelers for a place to stay and in the morning I'm going to pack a ""getaway"" bag with my clothing and jewelry.",0,1,65,False,False,False,True,False,False,False,False,858,4176,39,15,71,9,37,62,1.0
I have to force myself to remember to wear it.,0,1,109,True,True,False,True,True,False,False,True,4176,3,238,3068,8,22,57,12,1.0
"I hope he remembers, he kept saying he didn't want to put me through anything if the diagnosis was grim.",1,1,29,True,True,False,False,True,False,False,False,787,4176,4176,3068,8,9,10,8,1.0
I hope she's not shedding the tears that I am because I truly want her troubled soul to be at peace.,1,1,38,False,False,False,True,False,False,True,False,858,4047,3068,55,15,6,5,44,1.0
I hope you feel better soon.,0,0,35,True,False,True,False,True,True,False,True,858,787,472,4176,19,8,13,8,1.0
"I hope you get closure on this sooner rather than later, regardless of what you do about the gym.",1,1,47,True,False,False,True,False,False,False,False,858,787,10,238,21,8,139,41,1.0
I just never liked gravy so I didn't use it- I wasn't told any rules which she probably was supposed to tell me instead of ignoring me.,1,1,27,False,False,True,False,True,True,False,False,787,4176,19,153,8,9,73,13,1.0
"I just rolled with it for a while, but eventually realized that it was stupid for me to have to deal with it at all since he didn't even know it bothered me.",1,1,89,True,False,True,False,False,True,True,False,4047,231,2261,429,9,32,133,24,1.0
I know how it feels to get dumped too after having planned a future with someone you thought would love you back until old age.,1,1,45,False,False,True,False,False,False,False,False,4176,73,483,318,9,31,7,27,1.0
I know she would want me to be happy and I don't know if that's possible without her but by god I'll try.,1,1,38,False,False,False,False,False,False,False,False,858,4176,318,2261,13,9,32,588,1.0
I know the hurt is still fresh.,1,0,71,True,False,False,True,False,False,True,True,787,22,3068,62,11,17,11,30,1.0
