full_text,Emotional_disclosure,Information_disclosure,score,emo_disc.1,emo_disc.2,emo_disc.3,emo_disc.4,info_disc.1,info_disc.2,info_disc.3,info_disc.4,Throughput.1,Throughput.2,Throughput.3,Throughput.4,WorkTime.1,WorkTime.2,WorkTime.3,WorkTime.4,popularity
I didn't even realize that she was burned for a good while after meeting her.,0,1,30,False,True,False,True,False,False,False,False,858,787,71,285,15,8,70,22,1.0
I didn't get that opportunity unfortunately.,0,0,24,True,False,True,False,True,False,True,True,858,106,262,318,41,131,24,39,1.0
I didn<U+0092>t flinch one bit.,1,0,117,True,False,False,False,True,True,True,True,4176,169,231,847,9,29,34,23,1.0
I didn<U+0092>t know you were on Reddit too. /s,1,1,36,False,True,False,False,False,True,False,False,858,318,111,114,16,155,18,70,1.0
"I do not have bipolar or mania, but I do have adjustment disorder with anxiety and depression that is easily triggered by my environment.",0,1,29,True,True,True,False,False,False,False,False,787,4176,19,2261,9,9,32,159,1.0
I don't feel that our system of raising him degraded this world.,0,0,114,True,True,True,True,True,True,True,False,106,4047,231,414,124,11,26,34,1.0
I don't get how people judge a person's value by how much they make.,1,1,58,True,False,False,True,True,False,False,True,50,415,285,3068,30,42,27,6,1.0
"I don't know how to ratchet it down, because part of the cure is to understand that, most of the time, we don't know what's going on and things happening randomly is often how the world is supposed to work.",1,1,24,False,False,True,False,False,False,False,False,858,787,214,318,16,8,10,38,1.0
"I don't know what to say, man.",0,0,57,True,True,False,False,True,True,False,False,4176,483,3068,159,10,9,9,13,1.0
"I don't know who is telling you this is bad parenting, but they are just flat out wrong.",0,1,105,False,False,True,True,False,False,False,False,858,858,4047,3068,31,21,36,6,1.0
I don't know your income situation post support payments but I bet it's still something you can afford.,0,0,25,False,True,True,False,False,False,True,True,4176,741,22,231,9,13,28,37,1.0
I don't like getting on all fours and playing pretend.,1,1,48,False,False,False,True,False,False,False,False,858,4176,483,3068,17,11,5,7,1.0
"I don't mean to be disrespectful of anyone's cultural traditions, so I hope my genuine curiosity isn't taken as such.",1,0,36,False,False,False,True,True,True,False,False,84,4176,4047,106,13,9,18,18,1.0
I don't really want to be part of that if I can avoid it,0,1,57,False,False,True,True,True,False,False,False,4176,4047,483,3068,10,6,8,10,1.0
I don't think much good can come of it.,1,0,57,False,True,True,False,False,True,False,True,858,4176,74,169,18,8,71,16,1.0
I don<U+0092>t think a lot of people realize how insidious and damaging someone closing themselves off emotionally to their partner while becoming more emotionally involved with a crush can be even if nothing explicitly physical happens.,0,0,73,True,True,True,True,True,True,False,True,858,285,557,337,56,22,4,29,1.0
"I ended up with another girl, that I was with over a year, but ended up cheating on her with the first girl.",0,1,29,True,True,False,True,False,False,False,False,106,187,414,1098,41,119,44,29,1.0
"I explained to him that what seems like a harmless joke to him, may hit the other person in a way he was not intending.",1,0,26,False,False,True,True,True,False,False,True,858,4176,74,153,8,9,41,13,1.0
I feel it helps them heal.,1,0,64,False,False,True,False,True,False,True,False,4176,1310,285,337,9,27,17,18,1.0
I feel like ex-military may need MORE training in academy than their fellow civilians cadets to make sure they are adequately de-programmed from a war mentality on the beat.,1,1,25,False,False,True,False,False,False,False,False,4176,741,318,3068,9,17,89,6,1.0
I feel like I would be uncomfortable the whole time.,0,1,84,True,True,False,False,False,False,False,False,858,4047,3068,267,12,15,7,430,1.0
I felt like half of me had been ripped out.,1,1,29,False,False,False,False,False,False,False,False,858,4176,483,3068,31,10,10,7,1.0
I finally finished my degree and picked up my career again.,0,1,87,True,True,True,True,False,False,False,False,858,1306,4047,106,15,21,15,16,1.0
I firmly believe rape culture won't change until we accept rape as something that is *always* terrible and can affect *anyone*.,0,0,48,False,True,False,True,False,True,False,True,858,106,3068,2261,15,16,9,672,1.0
I found that that guy either wasn't really a doctor or was just kind of gone rogue.,0,0,35,True,True,False,True,True,True,False,True,106,472,3068,414,53,22,5,42,1.0
"I get it, it's supposed to be a super happy time, but people can be jerks.",1,1,35,True,False,False,False,True,False,False,False,858,4176,262,3068,20,8,33,9,1.0
"I got lucky to have my dad, and your baby girl is lucky to have you.",1,1,42,False,False,True,False,False,False,False,False,787,102,4176,3068,8,12,9,5,1.0
I got motivated and got my shit together.,0,1,85,False,True,True,True,False,False,False,True,858,3068,429,557,17,6,35,7,1.0
I got my first kiss at 16 and first girlfriend at 17.,0,1,24,True,True,True,True,False,True,False,False,4176,483,106,153,9,4,17,13,1.0
"I got out of the military, going through my second divorce, and my dad hands me a scrap of paper with a phone number on it, saying I NEEDED to call this person.",1,1,29,False,False,False,True,False,False,False,False,858,79,285,3068,61,17,18,7,1.0
I guess the hardest thing is knowing what truly would have been best would have been for her to have a present dad.,1,1,41,False,True,False,False,False,False,False,True,787,1306,3068,18,8,21,8,45,1.0
I had a similar epiphany after leaving my abusive ex.,1,1,104,False,False,False,False,False,False,False,True,169,3068,62,562,40,11,30,15,1.0
"I had asked the exterminator to leave them alone as much as he could, that's how effective they were.",0,0,78,True,True,False,True,True,False,False,True,858,165,4047,845,57,69,5,2,1.0
"I had friends whose parents died, and my school had to take in half of another school which was pretty much destroyed on that day.",1,1,117,True,False,False,False,True,False,True,False,4176,262,106,2261,10,28,28,30,1.0
I had to have a similar talk with my mother-in-law long ago.,0,0,30,False,True,True,False,False,True,True,False,858,4176,741,153,11,9,28,19,1.0
I have never been able to make friends.,1,1,48,False,True,False,False,False,False,False,False,858,787,285,267,17,10,16,24,1.0
"I have seen this happen countless times and wish I had done something about it and not fallen for the ""I guess I'll just try to better next time"" or feeling like I'm not a very good boyfriend.",1,1,29,False,True,False,False,False,False,False,False,858,50,787,359,16,46,8,30,1.0
"I have to admit, I clicked on your post expecting something terrible.",1,1,24,False,False,True,False,False,True,False,False,787,1310,318,106,8,17,31,24,1.0
I heard Aunt Lisa does car commercials.....,0,1,27,False,True,True,False,False,False,True,False,4176,60,1306,231,8,18,20,26,1.0
I hope I can find them homes.,1,0,57,False,False,False,False,False,False,True,True,858,512,4176,845,28,43,8,3,1.0
I hope it's his first step to living the rest of his life in a good and healthy spot.,0,0,81,True,False,True,True,True,True,False,True,858,285,94,111,18,20,137,23,1.0
I hope it helps to write that all out and maybe begin to start letting out those feelings you've kept inside for so long.,1,1,115,False,True,True,False,False,False,True,False,858,787,496,414,15,10,49,46,1.0
I hope people who need to read this will see this post.,1,1,41,False,False,True,True,True,False,False,False,787,214,3068,159,8,13,5,20,1.0
"I hope so too, although it's scary.",0,1,29,True,True,True,False,True,False,False,False,858,1310,4047,106,18,22,22,23,1.0
I hope they will find more positive role models to follow than their mom/grandpa.,1,1,79,False,True,False,False,False,False,False,True,4176,4047,73,62,9,20,47,50,1.0
I hope you're getting the help you need.,1,1,36,False,False,False,True,False,True,False,True,858,318,46,131,6,35,36,352,1.0
"I hope you are able to find a balance that allows you to be happy, and to truly appreciate the joys of having your son in your life, as well as to pursue your career and the interests that are important to you.",1,1,48,False,False,False,True,False,False,True,False,858,4176,3068,62,114,9,5,70,1.0
I just check my phone until I fall asleep,1,1,63,False,True,False,False,False,True,False,False,858,187,214,26,18,48,31,28,1.0
I just hope he knows that he did something for me and I'm grateful.,1,0,63,False,True,False,False,False,False,True,True,858,187,3068,368,56,23,7,184,1.0
"I just imagine my great friends and parents, and suddenly just leaving would make me feel more sad than free...  but it<U+0092>s awesome that you felt happy.",0,1,129,True,False,True,True,False,False,False,False,858,4176,4047,4047,14,11,7,9,1.0
I just know a small part of your life that you shared.,0,1,71,True,True,True,False,True,False,False,False,787,4047,231,3068,8,11,22,6,1.0
I just posted here because this is where I originally posted.,0,1,72,False,True,True,False,False,False,True,False,4176,4047,3068,111,9,104,7,28,1.0
I just went through this same thing.,1,1,54,False,False,False,False,False,True,False,False,858,4176,3068,3068,16,9,6,6,1.0
I kind of want to hear an update a bit later about how badly you got bombarded.,1,1,44,False,False,True,False,False,False,False,True,858,787,3068,299,52,8,5,26,1.0
I knew a couple who lost their two year old just after I lost my dad so I was very aware of not saying anything <U+0091>empty<U+0092> or that would take from their grief and we actually got onto the topic of *what* to say and they said so many people just avoided talking about their child at all for fear of upsetting them and they said that that was worse in some ways because it was as if no one remembered her or she had never existed which must have been such an awful concept for them to deal with.,1,1,33,False,False,False,True,False,False,False,False,858,1310,318,3068,20,28,50,6,1.0
"I knew girl friends who it had happen to, there were times where I'd go get drinks and return to see my gf being grinded on by some dude while she clearly looked uncomfortable, so I thought I got it, but no.",0,1,101,False,True,True,True,True,False,True,False,858,49,4047,231,17,53,7,63,1.0
"I knew what he was, but I ""had to try"" and ""was committed to making it work no matter what"".",1,1,31,False,True,False,False,False,False,False,True,858,4176,741,3068,8,8,32,7,1.0
I know I<U+0092>m doing it right when I see them smile.,1,1,36,False,False,False,False,False,False,False,True,858,58,285,3068,17,186,23,5,1.0
I know it's blunt but your love for your ex will never bloom.,1,0,82,True,False,False,True,True,False,True,True,6,4176,15,3068,32,9,72,5,1.0
I know it doesn't feel like it now but you deserve much much better than this guy.,1,0,45,False,True,True,False,False,True,True,False,4176,169,231,3068,8,20,19,8,1.0
I know you &amp; your team did the best they could.,1,0,28,False,True,True,False,False,False,True,True,858,787,96,414,7,9,51,31,1.0
I lick my wife's ass.,0,1,48,True,True,True,True,False,True,False,False,787,262,19,153,9,20,52,38,1.0
I lost my husband two years ago.,0,1,46,True,False,True,True,False,False,False,False,858,858,106,153,18,5,29,10,1.0
I love him so much,1,1,33,False,False,True,False,False,False,False,False,858,787,4176,109,19,7,10,19,1.0
I loved that age so much.,1,0,35,False,False,False,False,False,False,True,True,858,741,46,3068,15,15,9,6,1.0
"I mean, it's a pretty common expression (unfortunately), and we were just having a conversation.",1,1,33,False,False,False,False,False,False,False,True,858,4176,3,285,16,10,33,21,1.0
"I mean, maybe one day in the future, I'd like a child.",0,0,139,True,True,False,True,True,False,True,False,858,858,429,255,45,19,158,33,1.0
I miss my alone time and independence.,1,1,46,False,False,True,False,False,False,False,False,787,285,3068,359,10,18,7,18,1.0
I never really thought about it that way.,1,0,30,True,False,False,False,False,True,False,True,858,787,4176,483,45,81,9,4,1.0
"I nominate you for ""Most Likely to Meet the Love of Their Life"" in 3...2...1...",1,1,49,False,True,False,False,False,False,False,False,858,4176,483,3068,16,9,6,30,1.0
I once snapped one of those stupid kids IKEA plates in half because one of them whined it was the wrong.,0,1,34,True,True,False,False,False,False,False,False,73,169,111,348,20,35,60,28,1.0
I proudly proclaimed to my family I would marry him one day.,0,1,117,False,True,True,False,False,False,False,False,858,165,4047,368,164,53,15,13,1.0
I saw he left his glasses but it was too late to follow him so I held on to them.,0,0,111,False,True,False,True,True,True,False,False,50,4176,85,414,62,10,20,45,1.0
"I scroll through Reddit quite a bit and get so upset seeing just how many people post about how abusive, manipulative, and mean their parents were to them as kids.",1,1,40,False,False,False,False,False,False,False,False,858,50,4176,3068,51,36,11,6,1.0
I see people misusing anxiety as well.,1,0,51,False,False,False,False,True,True,True,False,4176,483,106,153,10,5,20,9,1.0
I started crying like I hadn't cried in years and now I'm crying writing this.,1,1,26,False,False,False,True,False,True,False,False,858,4176,4047,153,53,9,6,10,1.0
I started getting blowjobs - and she swallowed!!!,1,1,39,False,False,False,False,False,False,False,False,16,3068,62,359,59,6,56,19,1.0
I started not wanting any kids at all.,1,1,34,False,True,False,False,False,False,False,False,787,96,4176,62,7,20,9,30,1.0
"I strongly suggest you file for a permanent restraining order now, before it's too late.",0,0,49,False,True,False,True,False,True,False,True,3068,153,55,348,7,9,42,15,1.0
I struggle with depression but I wouldn't even consider cheating on my SO and lying to them.,1,1,53,True,False,False,True,False,False,False,False,28,787,60,169,50,8,23,28,1.0
I suggest you check if you can annul in this case.,0,0,27,True,True,False,True,True,True,False,True,106,55,231,3068,63,37,23,5,1.0
"I sure as hell didn't know, and I dropped the ball on that.",1,1,53,False,False,False,True,True,False,False,False,858,4176,483,3068,14,9,8,5,1.0
"I tend to... quip, then spell it out for people.",1,1,24,False,False,False,True,True,False,False,False,858,262,3068,19,16,18,6,26,1.0
I think it's safe to say that we've all been there - that realization that this isn't what we signed up for - and that life will never be the same again.,0,0,102,False,True,True,False,False,True,False,True,858,50,4176,4047,18,60,9,6,1.0
I think it is terribly cruel to essentially force someone like OP's son to continue living like this.,1,1,25,False,False,False,False,False,False,False,False,858,4176,153,58,6,8,20,42,1.0
"i think its the best thing to do, by breaking up with him. you will move on and find someone that will provide for you and love and care for you",1,1,29,False,False,False,False,False,False,False,False,4176,187,3068,62,9,121,121,44,1.0
I think my perfect guy would come around and open my door and help me out of the car.,1,1,34,False,False,False,False,False,False,True,False,858,3068,153,359,15,6,12,32,1.0
"I think OP is actually saying that the weight gain is a positive thing--that their girlfriend was severely underweight before from anorexia, and is now in treatment and on her way back to health.",1,1,70,True,False,False,True,True,False,False,False,858,106,318,1098,42,44,23,37,1.0
I think you and your wife did what was best for your twins by sending your son to a facility that could better meet his needs.,0,1,87,True,False,True,True,False,False,False,False,858,165,4047,483,28,63,7,5,1.0
"I think you did the right thing, he could have been hurt more if he found out differently.",0,0,25,False,True,False,True,False,True,False,True,4176,106,3068,116,10,13,7,24,1.0
I think you need to grieve her and move on.,0,1,55,False,True,False,True,False,False,False,True,787,483,318,3068,10,7,42,6,1.0
I think you should talk to a professional to help clear up what to do going forward.,0,0,61,True,False,False,True,False,False,True,True,858,234,73,111,18,18,30,18,1.0
"I took medieval European history, a survey on East Asia, the mandatory American history survey or two, and a series on World Military History.",0,0,46,False,False,True,True,False,True,False,True,858,4176,153,557,6,8,20,7,1.0
I want what's best for her.,0,1,41,False,True,True,True,False,False,False,True,858,787,395,4176,19,9,17,9,1.0
"I wanted a kid so bad that when friends who were pregnant at the same time as me talked about feeling connected to the little people growing inside of them, I felt more like a brood mare.",1,1,46,False,False,False,False,False,False,False,True,858,2,3068,109,6,78,10,32,1.0
"I was around 14 when my little brother, mom, and I were at the store.",0,1,26,False,True,True,True,False,False,True,False,858,787,4047,337,15,9,8,22,1.0
I was at the high school football game last night.,0,1,40,False,True,False,True,False,False,True,True,4176,496,3068,159,9,19,5,15,1.0
"I was exhausted from working on the heater and the pipes, so I asked him to call around in search of someone to bring us bottled water before the storm hit.",1,1,71,False,False,False,True,False,False,False,False,50,4176,1306,231,61,10,29,32,1.0
I was just a kid in school.,0,0,107,False,True,True,True,False,True,False,True,285,847,429,111,24,21,46,30,1.0
I was just the way it was.,1,1,98,False,True,False,False,False,False,False,False,4176,4047,3068,3068,9,55,9,7,1.0
I was prescribed Moafinil to keep me alert during the day.,0,0,38,False,True,True,True,False,True,True,False,4176,214,285,55,10,8,19,81,1.0
I was pretty much non-verbal until I was almost 4.,0,1,130,True,True,False,False,False,False,False,False,787,4176,231,267,8,10,73,25,1.0
I was stationed at hood back in those days.,0,1,31,True,False,True,True,False,False,False,False,169,3068,414,109,29,9,42,18,1.0
I was thinking along the same lines.,1,0,39,True,False,False,False,True,False,True,True,858,4176,106,565,18,9,15,20,1.0
I was thinking wth has that got to do with anything?,1,0,33,False,False,False,False,False,True,True,False,106,106,4176,1310,41,56,9,19,1.0
I was thinking wth has that got to do with anything?,1,1,33,False,False,False,False,False,True,True,False,106,106,4176,1310,41,56,9,19,1.0
I was working retail and one of my customers left behind a pair of Prada sunglasses.,0,1,111,True,True,True,True,False,False,False,False,858,67,238,159,7,20,35,15,1.0
I wasn't a cat person either until we adopted a second hand cat.,1,1,24,False,False,True,False,False,False,False,False,106,4176,847,10,83,11,16,46,1.0
I wasn't trying to invade her privacy.,1,1,33,False,False,True,False,False,False,False,False,858,787,3068,368,6,8,6,16,1.0
I will give you the advice I used to give to families who were in your same situation: Please try and get some rest at night and eat during the day.,1,1,39,True,True,False,False,False,False,True,False,16,106,496,153,46,58,69,17,1.0
"I will preface this that I am not the norm due to my education/profession of choice, but everything you said for me (and likely some others) is untrue...",1,1,32,False,True,False,False,False,True,False,False,858,231,3068,267,16,44,5,24,1.0
I will try to clarify.,0,1,79,True,True,True,False,True,False,False,False,4176,4047,483,285,11,7,8,22,1.0
I wish I knew more of what to say.,0,1,106,True,True,False,True,False,False,False,True,858,4047,3068,907,21,51,7,18,1.0
I wish you the best in life homegirl.,0,0,83,False,False,True,True,True,False,False,True,165,4176,4047,172,99,11,7,10,1.0
I wish you the best of luck!!,0,1,25,True,False,False,True,True,False,False,False,858,318,1098,348,15,31,33,192,1.0
I wonder if he realises it?,0,0,85,True,True,False,True,True,False,False,True,858,4176,123,429,37,10,11,52,1.0
I worked in some hostels and such to save money along the way.,1,1,41,False,True,False,False,False,False,False,False,858,4176,741,3068,15,9,27,40,1.0
I<U+0092>m a man and an extrovert.,0,1,74,True,True,True,False,False,False,True,False,4047,169,3068,429,32,25,6,29,1.0
I<U+0092>m not as familiar with TEFL and international laws/policies on teaching/mental health issues but i can<U+0092>t imagine that speaking to your school counsellor will come up!,1,1,43,False,False,True,False,False,False,False,True,858,106,89,3068,18,52,129,5,1.0
I<U+0092>m not saying your wife has cheated on you but you should be more suspicious than I was of her sudden change of heart.,1,1,39,False,True,False,False,False,False,False,False,858,4176,85,3068,14,10,15,5,1.0
I<U+0092>m so sorry that happened.,1,1,55,False,True,False,False,False,False,False,False,858,787,3068,109,13,8,9,26,1.0
I<U+0092>m sobbing reading this thread!,1,1,59,False,False,True,True,False,True,False,False,165,4047,187,231,77,6,15,17,1.0
"I<U+0092>ve had ptsd since 2016, when I helped my beloved dad pass onto/into wherever it is we go when we die (had been diagnosed with cancer only 6 weeks before he passed) in hospice.",0,1,130,True,True,True,False,False,True,False,False,858,2261,429,163,16,19,41,148,1.0
I<U+0092>ve never heard <U+0093>salat<U+0094> as an elegant form of salad.,1,1,45,True,False,False,False,False,False,False,False,858,4047,483,3068,25,10,4,6,1.0
"If a prospective employer or any governing entity sees it, it could seriously damage her future.",0,0,33,True,False,True,True,False,False,True,True,858,858,787,106,16,22,9,60,1.0
If he does at least he's not yours,1,1,32,True,False,False,False,False,False,True,False,787,4176,3068,2261,7,10,5,35,1.0
"If he is, he shouldn<U+0092>t let it drag out for 18 months.",1,1,44,True,False,False,False,True,False,False,False,106,4176,3068,172,27,9,8,20,1.0
"If he only comes around every 6 months, don<U+0092>t let him even be around her.",0,0,105,False,False,True,True,True,True,False,True,787,4176,60,65,9,10,130,121,1.0
If I<U+0092>m being honest I don<U+0092>t understand why he would want to see the baby at all??,1,0,56,False,False,False,False,True,False,False,False,858,395,4176,285,20,17,10,20,1.0
If I<U+0092>m being honest I don<U+0092>t understand why he would want to see the baby at all??,1,1,56,False,False,False,False,True,False,False,False,858,395,4176,285,20,17,10,20,1.0
If my dad hadn<U+0092>t waited as long as he did to get enough leverage in the custody battle.. then a lot of bad things could have happened to my sister and I.,1,1,31,False,False,False,True,False,False,False,False,858,106,19,1098,8,26,104,34,1.0
"If my family forced me to marry a woman I would become a huge ball of anxiety and not know what to do with myself, let alone have a healthy physical relationship with my arranged-wife.",1,1,90,True,True,False,False,False,True,False,False,512,4176,4047,483,58,9,7,4,1.0
"If OP's boyfriend didn't deny that, he was agreeing to the situation as she described it.",1,0,43,False,False,False,True,False,False,True,True,858,4176,169,131,21,11,22,26,1.0
"If she decides to act good, in the moment she'll be good.",0,0,35,True,False,False,True,True,True,False,True,858,4176,15,238,49,8,145,47,1.0
"If she wants to lose weight, she will and she needs to do it for her self and not you.",0,0,44,True,True,True,False,True,False,True,False,106,4047,429,173,31,13,61,28,1.0
"If someone gives a hotline number &amp; ""let me know if I can help!""",0,0,82,True,True,True,False,True,True,False,False,4047,845,111,337,5,3,23,26,1.0
"If someone says, ""No, I do NOT want a dog, I don't want to clean up crap and I don't want to feed it and walk it,"" why would you think they should have to feed, walk, and poop-clean it?",1,1,24,False,False,False,False,False,False,False,False,858,4176,85,267,7,8,19,27,1.0
"If there is a life after this one, then I'm sure it'll be a great adventure.",0,0,28,True,True,False,False,False,True,False,True,787,472,285,3068,7,14,27,8,1.0
If there was a heterosexual equivalent of that I would probably check that line out if I was in the right mood.,1,0,36,False,False,True,True,False,False,True,True,858,4176,15,386,19,13,41,19,1.0
"If things are that bad together and you really can<U+0092>t be faithful, do both of yourselves a favor and end it.",0,0,64,True,True,False,True,True,False,True,True,858,858,106,111,75,19,48,21,1.0
"If we look at the state of the US today, we don't need to hear people spouting the n word left and right to know that there are a surprisingly large amount of people who harbor some very racist sentiments.",1,0,30,False,False,False,True,True,False,True,True,4176,3068,62,565,8,11,102,31,1.0
"If we take a guy's shit, we're weak and childlike and it's our own fault for being abused because we're emotional creatures and not stoic and strong like big manly men.",1,0,103,False,True,False,True,True,True,False,True,4176,285,3068,907,9,18,7,28,1.0
"If you're into a guy, you find out what they want before you fall in love with them.",1,1,45,False,True,True,False,False,True,True,False,4176,60,187,168,9,23,39,16,1.0
If you feel like you need permission to kick them out and give the kids back to CPS (and probably end up in foster care) you certainly have my permission.,1,1,45,False,False,True,False,False,False,False,False,787,262,318,3068,8,27,105,6,1.0
If you have any questions feel free to ask and I'll do my best to answer them,0,0,28,True,False,True,True,True,False,False,True,858,187,285,106,18,30,18,15,1.0
If you love him and trust him then just roll with it.,0,0,25,False,False,True,True,True,True,False,True,787,472,4176,129,9,14,9,17,1.0
"If you love them, keep them.",0,0,38,True,False,False,True,True,True,False,True,472,4176,106,3068,20,9,11,6,1.0
"If you never noticed, he's never done it around you.",0,1,69,True,True,True,True,False,True,False,False,787,11,4047,483,33,41,16,5,1.0
"If you truly are remorseful, the signs will show.",1,1,28,False,True,False,False,False,True,False,False,858,483,231,3068,40,7,22,5,1.0
"If you want to talk/rant/whatever, my inbox is open!",0,1,43,False,False,True,True,False,False,True,False,858,1306,3068,111,17,20,8,18,1.0
