full_text,Emotional_disclosure,Information_disclosure,score,emo_disc.1,emo_disc.2,emo_disc.3,emo_disc.4,info_disc.1,info_disc.2,info_disc.3,info_disc.4,Throughput.1,Throughput.2,Throughput.3,Throughput.4,WorkTime.1,WorkTime.2,WorkTime.3,WorkTime.4,popularity
"""Divorce bad, coercing a woman into abortion good!""",1,0,29,False,False,True,False,True,False,True,True,106,60,3068,562,68,22,12,15,1.0
"""I don't care if I'm making things worse in every possible way, as long as those other guys don`t get to win.""",0,1,138,True,True,False,True,False,False,False,False,858,4176,4047,4047,17,9,20,9,1.0
"""In order for nonviolence to work, your opponent must have a conscience."" - Stokely Carmichael  Fascists don't have a conscience.",0,0,118,True,False,True,True,True,False,True,True,858,11,429,557,56,188,31,5,1.0
&gt; Don't try to talk it out.,0,0,25,True,True,False,False,True,False,True,False,787,4176,3068,62,9,9,6,35,1.0
&gt; I'm a musician and something about that caused my ex-wife to cheat on me.,0,1,66,True,True,True,False,True,False,False,False,741,4047,429,159,19,11,56,14,1.0
&gt; That makes no kindsa sense.,0,1,24,False,True,False,True,False,True,False,False,858,858,4176,22,17,15,9,27,1.0
&gt; we especially like taking it when we have to stay in a hotel.  huh. probably one of the very few i probably would prefer not to use one tbh.,1,1,37,True,False,False,False,False,False,False,True,858,787,512,159,5,15,59,23,1.0
&gt; You never did anything wrong  That's debatable.,1,1,57,False,False,True,False,False,False,True,False,858,106,4176,85,18,46,9,21,1.0
"&gt;I am also dumbstruck by the many comments here that support killing people because they are a financial burden on the state/taxpayer/society, etc.",1,0,25,False,True,True,False,False,False,True,True,858,787,13,386,14,12,38,19,1.0
&gt;Living in your girlfriends house because you can't afford your own.,1,1,37,False,True,False,False,False,False,False,True,858,4176,4176,153,14,10,8,9,1.0
&gt;Regardless to your opinion of whom will be doing the dealing  It should be a community of their peers ousting them.,0,0,35,True,False,True,True,True,True,False,True,106,4176,60,2261,44,11,29,754,1.0
&gt;Trilingual  &gt;What do you call someone who knows two languages?,0,1,94,False,True,True,True,False,False,True,False,787,4176,4047,26,11,12,8,22,1.0
"(Also, maybe use condoms in case she thinks you'd be happy about a baby once it was born?)",0,0,34,True,True,True,False,True,False,True,False,4176,845,231,3068,9,3,30,6,1.0
"(Not that I'm suggesting he is a prude, going by how his sense of humour etc)  &gt; Also, does he want to have children one day?",0,1,139,True,True,False,True,True,False,False,False,858,4176,4176,741,36,8,9,43,1.0
"(Not that I'm suggesting he is a prude, going by how his sense of humour etc)  &gt; Also, does he want to have children one day?",0,0,139,True,True,False,True,True,False,False,False,858,4176,4176,741,36,8,9,43,1.0
) ...you have time to do this.<U+0094>,0,0,52,True,False,True,True,True,False,False,True,50,285,845,3068,82,17,6,6,1.0
"*  I like to say that life is Shades of gray and few things are black and white, relationships are no different.",0,1,121,False,False,True,True,False,False,False,True,50,4176,94,3068,79,9,73,8,1.0
* It's impossible to make friends when you're sheltered and alone!,0,1,61,True,True,True,False,False,True,False,False,858,4047,15,3068,58,6,76,6,1.0
*Your things are in a storage unit on 123 Storage Company Road.,0,1,130,True,True,True,False,True,False,False,False,858,60,4047,3068,44,20,34,14,1.0
"[https://www.seattleu.edu/media/fostering\-scholars/files/FosteringScholars\_brochure.pdf](https://www.seattleu.edu/media/fostering-scholars/files/FosteringScholars_brochure.pdf)  The program even covers spending money, meal plan, housing... it is a 100&amp;#37; free ride.",0,0,25,True,True,False,True,True,True,False,True,4176,106,267,337,9,17,25,28,1.0
6 - Hire a CPA with a good reputation!,1,1,35,False,False,False,True,False,True,False,True,858,4176,3068,267,16,9,7,25,1.0
A bit of story for you...,0,1,58,False,False,True,True,False,False,False,True,4176,4047,3068,172,10,11,11,10,1.0
"A decade later I still miss him, but I've accepted we can only do so much for our furry family members.",1,1,120,False,True,False,False,False,False,False,False,858,50,3068,3068,56,58,16,21,1.0
A friend of mine who's getting married soon informed his fiance early on of their relationship that his mom is going to be living with him.,0,0,31,True,True,False,True,False,True,False,True,858,787,845,106,6,9,3,16,1.0
A game dropped last week that we both love.,1,1,32,False,True,False,False,True,False,False,False,858,787,741,231,19,10,18,33,1.0
A gender change is no excuse to abuse your partner.,0,0,95,False,True,True,True,False,True,True,True,169,285,231,199,41,18,23,64,1.0
A good indicator of intelligence is being to entertain other/opposing viewpoints without accepting them.,0,1,28,True,False,True,True,True,False,False,False,858,4176,4047,106,23,8,7,15,1.0
A low sex drive might be related to the fact that your wife is unpleasant and treats you like dirt.,0,1,46,True,False,False,True,True,False,False,True,4176,74,15,3068,9,70,76,6,1.0
A new place opened up I heard was really good!,0,0,51,False,True,True,True,True,True,False,True,787,106,162,4176,11,66,21,9,1.0
"A real, calm, sit down quietly together type of talk?",1,1,25,False,False,False,False,False,False,False,False,4176,1310,318,3068,10,25,19,8,1.0
"A third person in the relationship is never a good idea, dead or alive.",0,0,55,True,True,False,True,False,True,False,True,787,4176,3068,159,9,9,6,91,1.0
"About 4.5billion Asian people will say ""You are a really good son any parent can ask for"".",0,0,119,False,True,True,False,False,True,True,False,285,3068,111,159,24,8,27,17,1.0
About two years ago someone got into my car and only took Diet Sprite.,0,1,76,True,True,False,True,True,False,False,False,787,4176,4047,111,8,10,6,26,1.0
Abusers don't show their true colors right off the bat.,0,0,50,False,True,True,True,True,True,True,True,4176,106,62,565,10,12,36,16,1.0
Actually I know you will hunny.,0,0,65,True,False,True,True,True,True,True,True,231,238,2261,159,18,80,25,18,1.0
"Additionally, on top of sick time, you also have short term and long term disability, which is likely what cancer patients would take advantage of.",0,0,40,True,False,True,False,True,True,False,False,787,4176,741,285,8,9,31,19,1.0
After securing the little jerks my Dad took over.,1,1,26,False,True,False,False,False,False,False,False,787,4176,483,3068,11,10,5,6,1.0
"After seeing a therapist for the depression, he's now able to play games at a much healthier level.",0,1,36,False,True,True,True,False,False,False,True,787,187,413,26,8,25,10,25,1.0
"After that there was a mutual understanding that we may be against each other, but damn we're all still humans just trying to survive.",1,1,26,True,False,False,False,True,False,False,False,4176,214,3068,55,10,10,6,63,1.0
All the money in the world won't make a boring man attractive.,0,0,112,True,True,True,False,True,True,True,False,4176,285,231,3068,10,22,29,7,1.0
Almost makes me feel obligated to tell her I've done them.,1,1,25,False,True,False,False,False,False,False,False,102,4176,47,50,17,11,83,34,1.0
Also for the time being delete all of your social media.,0,0,38,False,True,False,True,False,True,False,True,858,4176,318,94,5,10,34,113,1.0
Also I'm not sure where you heard women have total control over child custody decisions but that's not supported by facts.,0,0,56,True,False,True,True,True,False,False,True,787,4176,60,483,8,11,29,6,1.0
"Also, focus on the fact that what you've chosen to do is a hugely valuable service to society.",1,1,35,True,False,True,False,False,False,True,False,67,4176,169,62,13,9,17,34,1.0
"Also, the economy fucking *sucks* right now.",1,1,36,False,False,True,False,False,False,True,False,4176,1310,106,3068,10,82,15,6,1.0
"An ex of mine said I was being too clingy and eventually realized he saw no future for us because we'd have different schedules, goals, and lives.",0,1,30,True,False,True,True,False,False,False,False,106,3068,1098,348,31,6,165,66,1.0
And a far better one.,1,1,64,False,True,False,False,False,False,False,True,858,4176,741,4047,17,8,50,70,1.0
And don't be so dammed sure there is no way she'd find out.,0,0,28,True,False,True,True,True,False,True,True,858,318,285,386,16,38,23,16,1.0
And from his reaction looks like it worked.,1,1,39,True,False,False,False,False,False,False,False,858,787,67,4176,21,8,14,10,1.0
And how they fuck you is by not offering the same plan next year.,0,1,28,True,True,False,True,True,False,False,False,858,787,60,4047,17,9,17,13,1.0
And I had a cookie before I left and I can confirm they are delicious.,1,0,39,False,False,False,True,False,True,True,False,858,4176,845,153,15,11,3,31,1.0
"And I had no idea, no idea at all until I got the call they were in the hospital.",0,1,51,True,False,True,True,False,False,False,False,787,4047,3068,153,8,14,6,13,1.0
And i just start to cry no matter where I<U+0092>m at.,0,1,39,True,True,False,True,False,False,False,False,787,4176,285,1098,12,9,21,44,1.0
And I thought I was a lightweight.,0,1,35,True,False,True,True,False,False,True,True,787,106,234,39,8,52,21,35,1.0
"And I<U+0092>m definitely not the <U+0093>dominate<U+0094> one in the relationship, I<U+0092>m just the one more ideas for names.",0,1,31,True,True,False,True,False,True,False,False,858,787,285,847,15,10,18,25,1.0
"And if we have to come crawling in under the umbrella of ""our society does not teach us about consent, and hands us all this awful socio-sexual power and doesn't tell us what to do with it, and it is a monstrous system that makes us into monsters, on purpose, by design, and it worked"" -- that's better than not coming in at all, even if it is, let's be honest, an unearned balm for the deservedly tortured soul.",1,0,31,False,True,False,False,True,True,False,True,106,231,3068,562,65,48,23,18,1.0
And it makes me laugh because it's so ridiculous,1,1,45,False,False,True,False,True,False,False,False,858,4047,2261,62,16,11,768,73,1.0
"And once you have the cat, if she lets you, you can decide whether to break up with her.",0,0,38,True,True,True,False,True,True,True,False,4176,187,285,267,9,235,20,29,1.0
And she was  upfront about wanting the kid.,1,1,32,False,False,False,True,False,False,False,True,858,3068,62,819,46,11,50,12,1.0
And then I realized I<U+0092>m an idiot <U+0001F602><U+0001F5E1>,1,0,75,False,False,False,False,False,True,True,True,4176,129,231,3068,9,25,18,9,1.0
"And then just a <U+0093>See you<U+0094> and a man-hug (you know, that quick pat on the back) when I drove off.",0,1,32,False,True,False,True,False,True,False,False,858,4176,60,3068,18,9,116,5,1.0
"And when people see themselves as having no freedom, they lash out at others they think are vulnerable",0,0,29,True,True,True,True,False,False,True,True,787,106,4176,129,8,61,10,22,1.0
"And yes I still love her, I have been with her and shared my life with her for almost 20 years.   oh and lol dude pathetic how you are such a slave to capitalism you have to personally attack me with personal posts I made that are irrelevant to this.",1,1,55,False,False,True,False,False,False,True,False,4176,3068,3068,429,9,5,7,73,1.0
"And yes, it was a tasteless, shitty, sexist joke.",1,1,40,False,True,False,True,True,False,False,False,106,4176,483,318,53,10,4,22,1.0
And you're lucky you found one pretty early in life.,0,1,44,False,True,False,True,False,True,False,False,106,4176,4047,3068,84,9,7,7,1.0
And you didn't recognize her at the time of viewing?,0,1,24,True,False,False,True,False,False,False,False,787,4176,483,3068,8,10,12,5,1.0
And you do not want to be tied to a family that is able to collectively lie to your face and let you get hurt on front of every that matters.,0,1,89,True,False,True,False,True,False,False,False,4176,214,496,285,10,12,24,17,1.0
Another one I read on reddit is chocolate sauce in the air ducts.,1,1,42,False,False,False,False,False,False,False,False,858,4176,3068,3068,16,10,8,8,1.0
Any chance you can move away?,0,1,67,True,False,True,False,True,False,False,False,4176,10,285,3068,9,29,17,7,1.0
"Anyway, it actually opened my eyes a lot to the kind of crap women have to put up with that as a straight man you might not typically consider.",1,1,46,False,False,False,True,False,False,False,False,858,858,60,3068,17,27,23,6,1.0
"Anyways, they went to two couples therapy sessions.",1,1,26,False,False,False,True,False,False,False,False,858,4176,4047,285,17,9,7,20,1.0
Are you of the same age?,0,1,29,True,False,False,True,False,False,False,True,858,4176,496,3068,17,10,35,5,1.0
"As a religious group they are by the far collectively, the most uneducated.",0,1,75,True,False,True,True,False,False,True,True,858,4047,169,29,54,25,21,781,1.0
"As a woman I sure as hell wished there were more men saying ""fuck this role of masculinity"".",0,0,28,False,True,False,True,False,False,True,True,787,4176,231,472,8,9,28,8,1.0
"As an immigrant myself, I'm proud of her.",1,1,36,True,False,False,True,True,False,False,False,858,4176,3068,45,15,9,5,52,1.0
"As I consider starting a family, things like this really make me worry about my kid having to be around evil assholes like these two.",1,1,31,False,False,False,True,False,False,False,True,4176,483,318,3068,10,12,41,7,1.0
"As someone else said, that's not poly.",0,1,52,True,True,False,False,False,True,False,False,787,285,3068,472,9,20,118,12,1.0
as someone who has ran into loose women that were married to military guys just for benefits and cheat when there away...i applaud you maam.,1,1,32,False,True,False,True,False,True,False,True,858,858,4176,234,27,22,8,36,1.0
"As the top comment on this post points out: actually, suicide hotlines *can* hurt. :(",0,1,40,False,True,True,True,False,False,False,True,858,787,4176,3068,14,9,9,6,1.0
"At some point CPS will say they've been with you this long and they see you as the main parent, congrats your a mommy now!",1,0,32,False,False,True,False,False,False,True,True,858,77,4176,1306,88,19,10,37,1.0
At the end of the day this is just an anecdotal argument.,0,0,28,True,True,True,True,True,False,True,True,4176,285,153,2261,9,20,8,744,1.0
At this point nothing at that job is going to make you happy and that<U+0092>s what you need desperately.,0,0,37,True,False,True,False,True,False,True,True,4176,741,106,153,9,17,20,27,1.0
Awww good boy biscuits <U+0001F642>,0,0,44,True,False,True,True,False,False,True,True,858,285,3068,614,14,21,5,12,1.0
Bc I'm a bad person,1,1,35,False,False,False,False,False,True,False,False,858,4176,483,3068,27,9,5,5,1.0
Because I<U+0092>m an attractive and accomplished woman and I shouldn<U+0092>t settle for anything less than love.,1,1,108,False,False,False,True,False,False,False,True,858,60,318,3068,21,34,30,11,1.0
Being an entrepreneur is expensive; it's a luxury.,0,1,43,True,False,False,True,False,False,False,True,858,4176,234,4047,18,9,23,8,1.0
Believe me there are many students even at your own school who do not have a group of people to hang out with.,0,1,54,True,True,True,True,False,False,False,True,787,4176,483,62,8,9,6,90,1.0
"betcha didn't think of *that*""  My brain isn't very helpful...",1,1,48,False,False,False,True,False,False,False,True,858,4176,3068,557,20,10,6,4,1.0
Break those ideal goals into smaller steps and milestones.,1,1,34,True,False,False,False,True,False,False,False,4176,483,3068,62,9,8,5,43,1.0
But ALL of that goes out the window this year.,0,1,57,True,False,True,True,True,False,True,False,50,62,159,1098,30,66,13,49,1.0
But also so grateful that you<U+0092>re being sensible about it and protecting the human loved ones in your home.,0,0,84,True,True,True,False,False,False,True,True,858,234,4047,285,15,26,27,26,1.0
"But him asking me, ""Are you done?""",0,1,26,True,False,False,True,False,False,False,True,787,4176,3068,299,8,9,5,24,1.0
But I have 3 more kids who also are adults just younger that my oldest was and four grandsons that need their papa.,1,1,28,False,False,False,True,False,True,False,False,4176,285,3068,907,8,24,6,31,1.0
But I love every minute of it.,0,0,26,True,True,True,False,False,True,False,True,787,4176,285,845,8,8,18,3,1.0
"But I really wanted some breathing room and if the worst happens and all my employees walked out in one day, I would be able to afford a small three room salon by myself.",0,1,35,True,False,True,True,False,False,False,False,858,787,4047,3068,13,8,16,6,1.0
But I recognised that I was hiding the depth of the conversations we had and I really wouldn't have felt comfortable sharing our text conversations with her etc.,1,1,48,True,False,False,True,False,False,False,True,787,8,318,3068,7,53,136,6,1.0
But I think that's part of where the feelings come from.,0,1,37,False,True,True,False,False,True,False,False,787,214,231,83,7,7,19,46,1.0
But I was lying to myself.,0,1,48,False,True,True,True,False,False,True,False,858,4176,3068,19,19,10,5,41,1.0
"But if it can<U+0092>t be fixed, it can<U+0092>t.",1,1,34,False,False,False,True,False,False,False,True,858,4176,34,3068,6,10,25,5,1.0
"But if you do, it's ok.",0,0,48,True,False,False,True,True,False,False,True,858,483,106,3068,11,5,10,5,1.0
"But it's one of the main reasons that people try to pretend abuse isn't happening, and it's dangerous.",1,0,26,False,False,False,True,True,True,True,True,4176,45,153,199,9,19,11,46,1.0
But she will always have a present mom.,0,0,41,True,False,True,False,False,True,True,False,787,4176,741,285,8,9,30,22,1.0
"But some choices, well, you won't know how they'll pan out.",0,0,54,True,False,True,True,True,False,True,False,4047,285,3068,414,6,26,4,42,1.0
"But something's gotta give, and soon.",0,0,73,True,True,False,True,True,True,False,False,4176,187,845,414,9,23,2,42,1.0
But the commonly accepted standard is 50-50.,0,1,44,True,True,False,True,False,True,False,False,787,60,214,3068,8,111,8,6,1.0
"But the thing is, good people return it whether they need it or not.",0,0,38,True,True,False,False,False,True,False,True,4176,169,3068,267,10,19,8,25,1.0
But the whole party situation effected her for weeks and shes told me multiple times that she appreciates that Ive stood up for her MULTIPLE TIMES.,1,1,27,False,False,False,False,False,False,False,True,858,741,3068,153,52,12,6,27,1.0
"But with time, you will heal.",0,0,83,True,True,True,True,True,False,True,False,787,60,285,845,7,20,22,2,1.0
"But, usually, to have the title of ""Librarian"" you need a master's degree in library/information science.",0,1,26,False,True,True,True,False,False,True,True,858,4176,285,423,6,10,24,12,1.0
Buy a fitbit and nail 8000 steps every day.,0,0,30,False,True,False,True,False,True,True,True,4176,3068,62,907,9,7,107,22,1.0
Call me elitist but Slipknot aren't typical metalheads.,1,1,25,False,False,False,False,False,False,False,False,858,16,3068,30,10,70,8,33,1.0
Call the police next time she wants to kill herself and let them handle her.,0,0,43,True,True,True,True,True,True,False,True,787,106,169,565,8,52,20,13,1.0
Can come across very manipulative.,1,1,27,False,False,False,True,False,False,False,True,858,4176,318,557,16,10,36,5,1.0
Can confirm that the Korean War never came up.,0,1,84,True,False,True,True,True,False,False,True,96,187,4047,3068,19,70,5,7,1.0
"Can say for certain that the lack of a response of ""Hi, hungry, I'm Dad"" has been detrimental to my academic performance",1,1,99,True,False,False,False,False,False,False,False,787,1310,15,3068,8,23,98,7,1.0
Can you *say that you're feeling ready to start exploring this with him?,0,0,121,True,True,True,True,False,True,False,True,858,4176,169,847,7,10,23,19,1.0
"Car &amp; Driver covered car safety a few years back, and using statistics, mentioned which safety features cut car accident fatalities.",0,1,25,True,True,True,False,True,False,True,False,787,28,55,35,9,12,47,31,1.0
Christians are some of the most hypocritical people around.,0,1,89,True,False,False,True,False,True,False,False,858,165,4047,472,16,59,12,16,1.0
Coming out as trans when in relationship is okay.,1,1,66,False,True,False,False,False,False,False,False,858,50,4047,3068,27,27,36,6,1.0
Communication with him is prob more enlightening than any of us can provide though.,0,1,35,True,True,False,True,True,False,False,False,858,787,285,1098,23,9,21,106,1.0
Complicated.  to say the least.,0,0,30,False,True,False,True,False,True,False,True,858,3068,153,2261,34,7,9,679,1.0
"Congrats on the better sleep, and the lowered risk of cardiavascular problems!",1,1,30,True,True,False,False,True,False,True,False,4176,214,106,2261,9,8,16,26,1.0
"Could you please pass the potatoes"".",0,0,25,False,False,True,True,True,False,True,False,858,858,4176,847,17,22,10,20,1.0
"Crack a huge yawn whenever he starts to speak, particularly if he's bragging.",0,0,25,False,True,True,True,False,True,True,True,4176,148,94,55,10,31,146,24,1.0
"Cum laude is definitely a huge achievement as well, congratulations!",1,1,45,True,False,False,False,False,False,False,True,4047,3,285,3068,27,55,22,7,1.0
"Cut him off completely, lawyer up, report this shit so there is a record, and get on with your lives.",0,1,31,False,True,True,True,False,True,False,True,4176,106,3068,109,9,15,8,22,1.0
Cut them out of your life if they do not comply.,0,1,58,True,False,False,True,False,False,True,False,165,4047,4047,472,55,18,6,16,1.0
"Cutting off friendships who aim to think of you that low or pull one on your husband like that, is the lowest of the low- imo and you should definitely cut all ties.",0,0,32,True,True,True,True,True,True,False,False,787,285,845,414,8,22,3,39,1.0
"Daaamn, can kids REALLY mess your life up that bad though?",1,1,50,True,False,False,False,True,False,False,False,4176,3068,3068,55,10,6,12,23,1.0
"Dad's don't have to be asked to 'watch the kids', that's just called parenting.",0,1,114,False,True,True,True,False,True,False,True,858,3068,299,429,11,6,20,29,1.0
Damn I didn<U+0092>t know it did that!,1,0,42,True,False,False,False,True,False,False,True,84,741,318,285,11,18,48,21,1.0
Damn I don<U+0092>t know why but your post just spooked the literal shit out of me.,1,1,130,False,False,False,False,True,False,False,False,165,3068,62,26,38,5,33,18,1.0
"Damn, I'm sorry if an ex rant is cliche,  but it feels good as hell to get that off my chest.",1,1,40,False,True,False,False,False,False,False,False,787,3068,2261,10,11,7,625,29,1.0
"Daughter finishing first year of grad school, dad doesn't make dad jokes for some reason, academic performance has been ok but dad related humor has suffered.",1,1,37,False,False,False,False,False,False,True,False,858,50,4176,3068,8,37,8,7,1.0
"December 11, my perfectly healthy happy perfect son was born.",1,1,43,True,False,False,False,False,False,False,True,858,1310,3068,159,26,17,11,16,1.0
Decide if smoking is a deal breaker for you or not - and don't be a nag.,0,1,29,True,True,False,False,False,False,True,False,858,787,67,557,70,8,16,5,1.0
Denial of that can cause many problems.,0,0,58,True,True,True,True,True,False,True,False,787,4176,231,148,8,9,52,34,1.0
"Depression, like cancer, is a disease.",0,0,45,True,True,True,True,True,False,True,True,4047,285,94,429,36,16,180,27,1.0
Did we have some issues we were working on?,0,1,50,False,True,True,False,False,True,False,False,787,3068,429,557,8,13,156,4,1.0
Did you find out any more information about the couple?,0,0,36,True,False,True,True,True,False,True,True,4176,169,231,74,10,17,18,24,1.0
Did you have evidence to support your beliefs?,0,0,28,False,False,True,True,False,False,True,True,858,512,3068,153,16,27,5,8,1.0
Do wedding gifts really matter that much?,1,1,49,True,False,False,False,True,False,False,True,858,3068,153,267,18,6,8,25,1.0
Do you have insurance through work?,0,1,32,False,False,True,True,False,False,False,True,858,787,40,3068,21,9,25,7,1.0
Do you have particular episodes that you feel highlight his channel best?,0,1,62,True,False,True,True,True,False,False,False,787,187,4047,4047,14,36,7,6,1.0
Do you have someone to talk to?,0,0,27,True,True,True,True,True,False,True,True,787,285,106,562,8,18,15,10,1.0
"Do you love her, or the woman she used to be?",0,0,26,True,False,False,True,True,False,True,True,4176,3068,153,299,10,7,9,21,1.0
Does making that choice disqualify you from being <U+0093>wife material<U+0094> too?,0,1,34,False,False,True,True,False,False,True,False,4047,318,3068,429,41,43,6,18,1.0
"Don't be afraid to let your feelings out, try not to feel guilty, but never forget the happy times you've had with your fluffy family member.",0,0,120,True,False,True,True,False,False,True,True,472,4176,129,4047,17,9,23,29,1.0
"Don't know if this helps, but remember that parenthood is a joint effort.",0,0,43,True,False,True,True,True,False,True,True,106,395,4176,414,69,33,9,56,1.0
"Don't let them make you feel guilty, make them own up to this and pay and hopefully they learn from this and are more careful in the future.",0,0,26,False,True,False,True,True,False,False,True,858,787,512,153,23,8,51,15,1.0
Don't lose faith in people.,0,1,53,True,False,True,False,False,False,True,False,787,46,483,169,8,58,7,16,1.0
Don't take your lead from her.,0,0,80,True,True,True,True,False,False,True,True,4176,4047,39,845,10,10,21,2,1.0
Don't you dare tell her shit about your massive and stupid indiscretion.,0,0,26,False,True,True,True,False,False,True,True,787,106,845,3068,8,86,2,51,1.0
"Don<U+0092>t speak for all women, I would 100% want to know.",0,0,26,False,True,True,True,False,False,True,True,787,84,285,94,8,16,22,84,1.0
"Dripping with melancholy, I hope you can be happier one day.",1,0,35,False,False,False,False,True,False,False,True,858,231,3068,472,13,22,5,13,1.0
"Drop the brother-in-law if you want, he seems like a dick.",0,1,26,False,True,True,True,False,True,False,True,787,4176,106,907,9,9,13,19,1.0
Dropbox and OneDrive will be my buds from now on.,0,0,74,True,True,True,False,False,True,True,True,4047,483,255,337,68,5,20,43,1.0
